,Number,Name_of_Covered_Entity,Region,Individuals_Affected,Date_of_Breach,Type_of_Breach,Location_of_Breached_Information,Date_Posted_or_Updated,Summary,breach_start,year
159,160,New York City Health & Hospitals Corporation's North Bronx Healthcare Network,Sengkang,1700000,12/23/2010,Theft,"Other, Electronic Medical Record",2014-05-28,"Unencrypted clinical system backup tapes that contained the electronic protected health information (ePHI) of 1,700,000 individuals were stolen from the unlocked vehicle of an employee of the covered entity's (CE) business associate (BA).  The ePHI included names, medical record numbers, social security numbers, addresses, telephone numbers, health plan numbers, dates of birth, dates of admission, dates of treatment, dates of discharge, dates of death, mother's name, next of kin, clinical information related to diagnosis, treatment, prognosis, laboratory tests and results, and medications.  Upon discovery of the breach, the CE filed a police report to recover the stolen items and provided breach notification to HHS, the media, and affected individuals.  As a result of OCR's investigation, the CE terminated its BA agreement and installed encryption software on backup media.  The breach incident involved a BA and occurred prior to the September 23, 2013, compliance date.  OCR verified that the CE had a proper BA agreement in place that restricted the BA's use and disclosure of PHI and required the BA to safeguard all PHI.",2010-12-23,2010
160,161,Long Beach Memorial Medical Center,Yio Chu Kang,2250,2010-10-12 00:00:00,Unauthorized Access/Disclosure,Other,2014-01-23,,2010-12-10,2010
161,162,Walgreen Co.,Boon Lay,2700,1/26/2011,Theft,"Other Portable Electronic Device, Other",2014-06-10,,2011-01-26,2011
162,163,"Charleston Area Medical Center, Inc",Kent Ridge,3655,2011-08-02 00:00:00,Unauthorized Access/Disclosure,Network Server,2014-01-23,,2011-02-08,2011
163,164,Mountain Vista Medical Center,Toa Payoh,2291,10/13/2010,Loss,"Other Portable Electronic Device, Other",2014-01-23,,2010-10-13,2010
164,165,Departamento de Salud de Puerto Rico,Ang Mo Kio,2621,3/14/2010,Unknown,Desktop Computer,2014-01-23,,2010-03-14,2010
165,166,Henry Ford Hospital,Newton,2777,1/31/2011,Loss,"Other Portable Electronic Device, Other",2014-01-23,,2011-01-31,2011
166,167,"Central Brooklyn Medical Group, PC",Sengkang,500,2010-03-08 00:00:00,Theft,Paper,2014-06-20,"OCR opened an investigation of the covered entity (CE), Preferred Health Partners f/k/a Central Brooklyn Medical Group, after it reported appointment schedules, pathology reports and portions of medical records containing the protected health information (PHI) of 500 individuals were stolen from an office.  The PHI included names, ages, telephone numbers, social security numbers, medical insurance information, pathology reports, and other clinical information.  Upon discovery of the breach, the CE filed a police report and worked with law enforcement authorities to recover as much of the PHI as possible that was stolen.  As a result of OCR's investigation, the CE removed PHI such as social security or medical insurance numbers from tracking logs.  In addition, the CE improved safeguards by storing log binders in a locked area and shredding documents regularly.  Further, the CE replaced the manual process of printing certain records with an electronic verification system.  The CE also archived, stored off site, and locked up all paper records and retrained all staff on its HIPAA policies and procedures. ",2010-08-03,2010
167,168,TRICARE Management Activity,Redhill,4500,6/25/2010,Unauthorized Access/Disclosure,Paper,2014-01-23,,2010-06-25,2010
168,169,Blue Cross and Blue Shield of Florida ,Sembawang,7366,10/16/2010,Unknown,Other,2014-01-23,,2010-10-16,2010
169,170,"University Health Services, University of Massachusetts, Amherst",Paya Lebar,942,9/29/2010,Unauthorized Access/Disclosure,Desktop Computer,2014-01-23,,2010-09-29,2010
170,171,"Omnicare, Inc",Kembangan,8845,1/19/2011,Theft,Laptop,2014-01-23,,2011-01-19,2011
171,172,"JEFFREY J. SMITH, MD",Bukit Gombak,600,11/24/2010,Loss,"Desktop Computer, Other Portable Electronic Device, Other",2014-01-23,,2010-11-24,2010
172,173,University of Missouri Health Plan,Queenstown,765,2011-10-01 00:00:00,Unauthorized Access/Disclosure,Paper,2014-01-23,,2011-01-10,2011
173,174,"Rape & Brooks Orthodontics, P.C.",Clementi,20744,2011-03-02 00:00:00,Theft,"Desktop Computer, Network Server, Other Portable Electronic Device, Other",2014-01-23,,2011-02-03,2011
174,175,Clarksburg - Louis A. Johnson VA Medical Center,Kent Ridge,1470,10/26/2010,Unauthorized Access/Disclosure,Paper,2014-01-23,,2010-10-26,2010
175,176,County of Los Angeles,Yio Chu Kang,667,2/23/2011,Theft,Laptop,2014-01-23,,2011-02-23,2011
176,177,EISENHOWER MEDICAL CENTER,Yio Chu Kang,514330,2011-11-03 00:00:00,Theft,Desktop Computer,2014-01-23,,2011-03-11,2011
177,178,Catholic Social Services,Woodlands,1700,2011-01-02 00:00:00,Theft,Laptop,2014-06-30,"A personal laptop computer containing the electronic protected health information (ePHI) of 1,700 individuals and approximately 493 adoption home studies was stolen from a contractor's vehicle.  The ePHI involved included names, addresses, phone numbers, dates of birth, driver's license numbers, health information, and social security numbers.  At the time of the breach, the covered entity (CE) did not have a business associate (BA) contract with the contractor.  Following OCR's investigation, the CE developed policies and procedures for obtaining BA contracts as required by the Privacy Rule and verified that the contractor no longer had a business relationship with the CE.  OCR obtained assurances that breach notification was provided to the affected individuals, HHS, and the media.",2011-02-01,2011
178,179,"Park Avenue Obstetrics & Gynecology, PC",Toa Payoh,635,3/25/2011,Theft,"Other Portable Electronic Device, Other",2014-01-23,,2011-03-25,2011
179,180,"Brian J Daniels D.D.S.,Paul R Daniels D.D.S.",Toa Payoh,10000,2011-01-03 00:00:00,Theft,"Other Portable Electronic Device, Other",2014-01-23,,2011-03-01,2011
180,181,MidState Medical Center,Admiralty,93500,2/14/2011,Loss,Other,2014-01-23,,2011-02-14,2011
181,182,"Patient Care Services at Saint Francis, Inc.",Bukit Gombak,84000,1/13/2011,Theft,Network Server,2014-03-13,,2011-01-13,2011
182,183,Union Security Insurance Company,Queenstown,935,2/18/2011,Unauthorized Access/Disclosure,Other,2014-01-23,,2011-02-18,2011
183,184,Oklaholma State Dept. of Health,Bukit Gombak,132940,2011-06-04 00:00:00,Theft,"Laptop, Paper",2014-04-23,,2011-04-06,2011
184,185,Aiken Community Based Outpatient Clinic,Little India,2717,2/16/2011,Improper Disposal,Paper,2014-01-23,,2011-02-16,2011
185,186,"Health Net, Inc.",Yio Chu Kang,1900000,1/21/2011,Unknown,Other,2014-01-23,,2011-01-21,2011
186,187,SW General Inc,Toa Payoh,566,2004-01-05 00:00:00,Theft,Paper,2014-01-23,,2004-05-01,2004
187,188,Fairview Health Services,Chai Chee,1215,2/19/2011,Loss,Paper,2014-01-23,,2011-02-19,2011
188,189,Time Insurance Company,Simei,675,2011-01-02 00:00:00,Unauthorized Access/Disclosure,Other,2014-04-23,,2011-02-01,2011
189,190,Community Action partnership of Natrona County,Teban Gardens,15000,2/23/2011,Hacking/IT Incident,Desktop Computer,2014-01-23,,2011-02-23,2011
190,191,"Keith & Fisher, DDS, PA",Bukit Panjang,6000,2/16/2011,Hacking/IT Incident,Network Server,2014-01-23,,2011-02-16,2011
191,192,MacNeal Hospital,Boon Lay,845,2011-10-03 00:00:00,Hacking/IT Incident,"Laptop, Desktop Computer, Network Server, E-mail",2014-03-24,,2011-03-10,2011
192,193,West Lake Hospital ,Boon Lay,686,2011-10-03 00:00:00,Hacking/IT Incident,"Laptop, Desktop Computer, Network Server, E-mail",2014-03-24,,2011-03-10,2011
193,194,Phoenix Health Plan,Toa Payoh,9393,2011-10-03 00:00:00,Hacking/IT Incident,"Laptop, Desktop Computer, Network Server, E-mail",2014-04-23,,2011-03-10,2011
194,195,MacNeal Physician Group,Boon Lay,532,2011-10-03 00:00:00,Hacking/IT Incident,"Laptop, Desktop Computer, Network Server, E-mail",2014-03-24,,2011-03-10,2011
195,196,Genesis Clinical Laboratory,Boon Lay,1070,2011-10-03 00:00:00,Hacking/IT Incident,"Laptop, Desktop Computer, Network Server, E-mail",2014-03-24,,2011-03-10,2011
196,197,Knox Community Hospital,Jurong East,500,2010-01-10 00:00:00,Improper Disposal,Other,2014-01-23,,2010-10-01,2010
197,198,Speare Memorial Hospital,Macpherson,5960,2011-02-04 00:00:00,Theft,Laptop,2014-03-13,,2011-04-02,2011
198,199,Reid Hospital & Health Care Services,Novena,22001,2011-02-04 00:00:00,Theft,Laptop,2014-01-23,,2011-04-02,2011
199,200,Union Security Insurance Company,Queenstown,850,3/24/2011,Unauthorized Access/Disclosure,Other,2014-01-23,,2011-03-24,2011
200,201,Indiana Regional Medical Center,Serangoon,1388,9/28/2010,Theft,Paper,2014-01-23,,2010-09-28,2010
201,202,"MMM Healthcare, Inc.",Ang Mo Kio,32390,2011-08-03 00:00:00,Theft,Desktop Computer,2014-01-23,,2011-03-08,2011
202,203,PMC Medicare Choice,Ang Mo Kio,24361,2011-08-03 00:00:00,Theft,Desktop Computer,2014-01-23,,2011-03-08,2011
203,204,CVS CAREMARK,Toa Payoh,654,1/17/2011,"Theft, Unauthorized Access/Disclosure",Paper,2014-04-23,,2011-01-17,2011
204,205,CENTER FOR ARTHRITIS & RHEUMATIC DISEASES,Sembawang,8000,2011-01-01 00:00:00,Theft,"Other, Paper",2014-01-23,,2011-01-01,2011
205,206,"Robert B. Miller, MD",Yio Chu Kang,620,2011-01-04 00:00:00,Theft,Laptop,2014-01-23,,2011-04-01,2011
206,207,Imaging Center of Garland,Yishun,1031,3/15/2011,Improper Disposal,Other,2014-01-23,,2011-03-15,2011
207,208,New York State Department of Health,Sengkang,550,4/17/2011,Theft,Paper,2014-06-03,"A bag containing 43 pages of protected health information (PHI) of 550 nursing home residents and an encrypted laptop computer were stolen from the vehicle of an employee of the covered entity's (CE) business associate (BA).  The PHI included names, dates of birth, gender identities, names of the nursing homes, and Medicaid numbers.  Upon discovery of the breach, the CE filed a police report and provided breach notification to HHS, the media, and all affected individuals, as well as offering one year of free identity theft protection.  Following OCR's investigation, the CE's BA terminated the employee and re-trained its staff on its privacy and security policies, including not leaving laptops in unoccupied vehicles.  In addition, the CE reminded all contractors about the need to safeguard confidential information, and reviewed the BA's contractual obligations relating to safeguarding PHI.   The breach incident involved a BA and occurred prior to the September 23, 2013, compliance date.  OCR verified that the CE had a proper BA agreement in place that restricted the BA's use and disclosure of PHI and required the BA to safeguard all PHI.",2011-04-17,2011
208,209,St. Mary's Hospital for Children,Sengkang,550,4/17/2011,Theft,Paper,2014-06-02,"A laptop computer containing the protected health information (PHI) of approximately 550 individuals was stolen from the vehicle of the business associate's (BA) workforce member.  The PHI included names, dates of birth, gender identities, names of nursing homes, and Medicaid numbers of the covered entity's (CE) patients.  Following the breach, the BA terminated the employee who was involved in the breach and provided credit monitoring services to the affected individuals.  The BA also re-trained its staff.  Following OCR's investigation, the CE and the BA reviewed the BA's contractual obligations relating to PHI during an in-person meeting.  The breach incident involved a BA and occurred prior to the September 23, 2013, compliance date.  OCR verified that the CE had a proper BA agreement in place that restricted the BA's use and disclosure of PHI and required the BA to safeguard all PHI.",2011-04-17,2011
209,210,Medicare Fee-for-Service Program,Tanglin,13412,2011-11-04 00:00:00,Unauthorized Access/Disclosure,Paper,2014-01-23,,2011-04-11,2011
210,211,VA Caribbean Healthcare System,Ang Mo Kio,6006,3/30/2011,Theft,Paper,2014-06-19,"An employee of the covered entity (CE), VA Caribbean Healthcare System, left documents containing the protected health information (PHI) of 6,006 individuals in an unsecure bag at a nursing station.  The PHI included names, social security numbers, patient care assignments, patient counts and patient census lists.  Upon discovery of the breach, the CE secured the PHI and provided breach notification to HHS, the media, and affected individuals.  As a result of OCR's investigation, the CE disciplined and retrained the employee and implemented a procedure that nursing leadership is required to conduct rounds on wards once vacated.  The CE also retrained all staff on its privacy and security policies and procedures.",2011-03-30,2011
211,212,Blue Cross Blue Shield of Michigan,Newton,11387,11/17/2010,"Unauthorized Access/Disclosure, Hacking/IT Incident",Network Server,2014-01-23,,2010-11-17,2010
212,213,Spartanburg Regional Healthcare System,Little India,400000,3/28/2011,Theft,Desktop Computer,2014-01-23,,2011-03-28,2011
213,214,Saint Joseph - Berea,Kembangan,1986,4/14/2011,"Theft, Loss","Other Portable Electronic Device, Other",2014-04-23,,2011-04-14,2011
214,215,Navos,Punggol,2700,3/15/2011,Unknown,Paper,2014-01-23,,2011-03-15,2011
215,216,"Dunes Family Health Care, P.C",Boon Keng,17000,2011-11-03 00:00:00,Theft,"Other Portable Electronic Device, Other",2014-02-14,,2011-03-11,2011
216,217,"Metropolitan Community Health Services, Inc.",Bukit Panjang,1263,5/18/2011,Unknown,E-mail,2014-04-23,,2011-05-18,2011
217,218,TUBA CITY REGIONAL HEALTH CARE CORPORATION,Toa Payoh,2000,2011-01-04 00:00:00,"Loss, Improper Disposal",Paper,2014-01-23,,2011-04-01,2011
218,219,"FOOTHILLS NEPHROLOGY, PC",Little India,1280,4/28/2011,Theft,"Other Portable Electronic Device, Other",2014-01-23,,2011-04-28,2011
219,220,Sutter Gould Medical Foundation (SGMF),Yio Chu Kang,1192,5/23/2011,Loss,Paper,2014-01-23,,2011-05-23,2011
220,221,Silverpop Systems Inc. Health and Welfare Plan,Eunos,884,4/15/2011,Theft,Laptop,2014-01-23,,2011-04-15,2011
221,222,New River Health Association,Kent Ridge,950,2011-01-04 00:00:00,Unauthorized Access/Disclosure,Paper,2014-01-23,,2011-04-01,2011
222,223,HealthCare Partners,Yio Chu Kang,15677,4/17/2011,Theft,Desktop Computer,2014-01-23,,2011-04-17,2011
223,224,"Gene S. J. Liaw, MD. PS",Punggol,1105,2011-04-04 00:00:00,Loss,"Other Portable Electronic Device, Other",2014-01-23,,2011-04-04,2011
224,225,Blue Cross and Blue Shield of Florida ,Sembawang,3463,2011-11-04 00:00:00,Unauthorized Access/Disclosure,Other,2014-01-23,,2011-04-11,2011
225,226,"NOL, LLC d/b/a Premier Radiology",Bishan,810,2011-07-05 00:00:00,Theft,Laptop,2014-04-23,,2011-05-07,2011
226,227,"Advanced Diagnostic Imaging, P.C.",Bishan,705,2011-07-05 00:00:00,Theft,Laptop,2014-04-23,,2011-05-07,2011
227,228,University of Missouri Health Care,Queenstown,1288,6/14/2011,Unknown,Paper,2014-01-23,,2011-06-14,2011
228,229,Accendo,Toa Payoh,175350,2011-01-01 00:00:00,Unauthorized Access/Disclosure,Paper,2014-01-23,,2011-01-01,2011
229,230,Ohio Health Plans,Jurong East,78042,2011-03-06 00:00:00,Theft,Laptop,2014-01-23,,2011-06-03,2011
230,231,"Gail Gillespie and Associates, LLC",Kovan,2000,6/25/2011,Theft,"Laptop, Desktop Computer, Network Server, E-mail, Other Portable Electronic Device, Other, Electronic Medical Record",2014-01-23,,2011-06-25,2011
231,232,Health Plan of San Mateo,Yio Chu Kang,694,4/25/2011,Unauthorized Access/Disclosure,Paper,2014-01-23,,2011-04-25,2011
232,233,Department of Health Care Policy and Financing,Redhill,3589,2011-06-05 00:00:00,Loss,Other,2014-02-14,,2011-05-06,2011
233,234,Yanez Dental Corporation,Yio Chu Kang,10190,5/22/2011,Theft,"Desktop Computer, Network Server",2014-01-23,,2011-05-22,2011
234,235,Jackson Health System,Sembawang,1562,2008-01-10 00:00:00,Unauthorized Access/Disclosure,"Other, Electronic Medical Record",2014-01-23,,2008-10-01,2008
235,236,The Mount Sinai Hospital,Sengkang,712,2011-07-06 00:00:00,Theft,Laptop,2014-06-02,"Two unencrypted laptop computers containing the electronic protected health information (ePHI) of 712 individuals were stolen from the covered entity's (CE) office.  The ePHI included names, dates of birth, social security numbers, diagnostic reports, and demographic information.  Upon discovery of the breach, the CE filed a police report to recover the stolen items.  As a result of OCR's investigation, the CE improved physical security by installing an exit alarm lock and surveillance camera, and implementing a policy and procedure requiring managers to monitor inappropriate use of the facility's rear exit.  The CE also inventoried its ePHI systems and adopted and implemented policies and procedures for workstation security, encryption, security awareness and training, electronic devices, and media controls.",2011-06-07,2011
236,237,Troy Regional Medical Center,Clementi,880,3/22/2011,Unauthorized Access/Disclosure,Paper,2014-01-23,,2011-03-22,2011
237,238,Lansing Community College,Newton,5000,2011-09-05 00:00:00,Hacking/IT Incident,Network Server,2014-03-24,,2011-05-09,2011
238,239,Dr Axel Velez,Ang Mo Kio,2800,6/19/2011,Theft,Desktop Computer,2014-03-13,,2011-06-19,2011
239,240," DeKalb Medical Center, Inc. d/b/a DeKalb Medical Hillandale",Eunos,7500,2010-11-07 00:00:00,Theft,Paper,2014-01-23,,2010-07-11,2010
240,241,Beth Israel Deaconess Medical Center,Paya Lebar,2021,4/17/2011,Hacking/IT Incident,Network Server,2014-01-23,,2011-04-17,2011
241,242,"Gypsum Management and Supply, Inc. Medical and Dental Plan",Eunos,25330,2011-09-05 00:00:00,Unauthorized Access/Disclosure,Network Server,2014-01-23,,2011-05-09,2011
242,243,"Andersen Air Force Base, Guam",Marine Parade,700,5/13/2011,Improper Disposal,Paper,2014-01-23,,2011-05-13,2011
243,244,Molina Medicare,Yio Chu Kang,4573,2011-01-01 00:00:00,Unauthorized Access/Disclosure,Paper,2014-01-23,,2011-01-01,2011
244,245,Windsor Health Plan,Bishan,1378,2011-01-03 00:00:00,Unauthorized Access/Disclosure,Paper,2014-01-23,,2011-03-01,2011
245,246,Health Care Service Corporation,Boon Lay,501,6/28/2011,Theft,Paper,2014-01-23,,2011-06-28,2011
246,247,University of Kentucky - UK HealthCare,Kembangan,3604,2011-07-06 00:00:00,Theft,Laptop,2014-04-23,,2011-06-07,2011
247,248,"Austin Center for Therapy and Assessment, LLC",Yishun,1870,2011-08-07 00:00:00,Theft,Laptop,2014-04-24,"An unencrypted laptop, containing the electronic protected health information (ePHI) of 1,870 individuals, was stolen from the covered entity's (CE) office.  The ePHI involved includes clinical evaluation reports, test results, patient names, addresses, phone numbers, and social security numbers.  Upon discovery of the breach, the CE notified affected individuals, OCR and the media.  Following OCR's investigation, the CE revised its HIPAA policies and procedures, implemented additional physical safeguards in its facility and installed encryption software.",2011-07-08,2011
248,249,Treatment Services Northwest,Boon Keng,1200,2011-08-07 00:00:00,Theft,Desktop Computer,2014-01-23,,2011-07-08,2011
249,250,Mills-Peninsula Health Services,Yio Chu Kang,1500,2009-01-11 00:00:00,Unauthorized Access/Disclosure,Paper,2014-01-23,,2009-11-01,2009
250,251,Brigham and Women's Hospital and Faulkner Hospital ,Paya Lebar,638,6/21/2011,Theft,Other Portable Electronic Device,2014-06-30,"A covered entity's (CE) workforce member lost an external hard drive containing the electronic protected health information (ePHI) of 638 individuals while traveling.  The external hard drive included names, medical record numbers, dates of admission, medications, diagnoses, and treatment information.  The CE notified HHS, the media, and all individuals affected regarding the breach and provided individuals with identity protection services.  Following the breach, the CE sanctioned the workforce member involved and retrained the workforce member and division staff on  safeguards for ePHI.  In addition, the CE established a mitigation workgroup to review policies and procedures regarding the protection of ePHI and created a new external hard drive encryption policy.  OCR obtained assurances that the CE  implemented the corrective action listed above.",2011-06-21,2011
251,252,"Ashley Industrial Molding, Inc. Employee Welfare Benefit Plan ",Novena,506,2011-09-05 00:00:00,Hacking/IT Incident,Network Server,2014-01-23,,2011-05-09,2011
252,253,St. Francis Hospital,Marsiling,948,2011-01-06 00:00:00,Loss,"Other Portable Electronic Device, Other",2014-06-10,,2011-06-01,2011
253,254,"Reznick Group, P.C.",Tanglin,2459,2011-09-05 00:00:00,Hacking/IT Incident,Network Server,2014-03-25,,2011-05-09,2011
254,255,The Neurological Institute of Savannah & Center for Spine,Eunos,63425,2011-02-07 00:00:00,Theft,"Other Portable Electronic Device, Other",2014-01-23,,2011-07-02,2011
255,256,Texas Health Presbtyerian Hospital Flower Mound,Yishun,10345,6/21/2011,Theft,Laptop,2014-01-23,,2011-06-21,2011
256,257,Capron Rescue Squad District,Boon Lay,815,2011-05-02 00:00:00,Unauthorized Access/Disclosure,Laptop,2014-01-23,,2011-02-05,2011
257,258,Cook County Health & Hospitals System,Boon Lay,32008,6/24/2011,Theft,"Other Portable Electronic Device, Other",2014-01-23,,2011-06-24,2011
258,259,"HEALTH RESEARCH INSTITUTE, INC., PFEIFFER TREATMENT CENTER",Boon Lay,2000,2011-01-07 00:00:00,Theft,"Desktop Computer, Network Server",2014-01-23,,2011-07-01,2011
259,260,Stanford Hospital & Clinics,Yio Chu Kang,19651,2010-09-09 00:00:00,Unauthorized Access/Disclosure,Other,2014-01-23,,2010-09-09,2010
260,261,"Muir Orthopaedic Specialists, A Medical Group Inc.",Yio Chu Kang,1800,7/27/2011,Theft,Paper,2014-01-23,,2011-07-27,2011
261,262,NEA Baptist Clinic,Bouna Vista,3116,2011-12-07 00:00:00,Hacking/IT Incident,Network Server,2014-01-23,,2011-07-12,2011
262,263,Jonathan Noel MD,Novena,2059,7/13/2011,Theft,"Other Portable Electronic Device, Other",2014-01-23,,2011-07-13,2011
263,264,Centro de Ortodoncia Inc.,Ang Mo Kio,2000,2010-06-05 00:00:00,Theft,Paper,2014-06-20,"OCR opened an investigation of the covered entity (CE), Dr. Pedro Valentin, after it reported boxes containing the protected health information (PHI) of 2,000 individuals were moved from the CE's office.  The PHI included names, account numbers, responsible party in charge of account, and method of payment.  OCR's investigation revealed that the individual who removed the PHI was the CE's wife and business partner.  The CE advised OCR that he knew his wife/partner was removing the boxes for the purpose of ascertaining the amount of monies the CE was receiving and that he is in the process of dissolving the partnership.  OCR concluded that the actions alleged in the breach report did not amount to a breach.",2010-05-06,2010
264,265,"John T. Melvin, M.D.& Associates",Yishun,2541,2011-09-08 00:00:00,Theft,Paper,2014-03-13,,2011-08-09,2011
265,266,"Diversified Resources, Inc.",Eunos,863,2011-11-08 00:00:00,Theft,Laptop,2014-01-23,,2011-08-11,2011
266,267,"Bonney Lake Medical Center and Mythili R. Ramachandran, MD",Punggol,2367,2011-12-08 00:00:00,Theft,"Laptop, Desktop Computer",2014-02-14,,2011-08-12,2011
267,268,United States Steel Corporation Plan for Active Employee Insurance Benefits and the United States Steel Corporation Plan for Retiree Insurance Benefits,Serangoon,4000,8/15/2011,Loss,"Other Portable Electronic Device, Other",2014-03-24,,2011-08-15,2011
268,269,VA Illiana Health Care System,Boon Lay,518,7/14/2011,Loss,Paper,2014-01-23,,2011-07-14,2011
269,270,Health Texas Provider Network,Yishun,1259,7/27/2011,Theft,Laptop,2014-03-13,,2011-07-27,2011
270,271,Blue Cross of Northeastern Pennsylvania,Serangoon,507,2011-09-09 00:00:00,"Theft, Unauthorized Access/Disclosure","Laptop, Paper",2014-03-24,,2011-09-09,2011
271,272,NYU Hospital for Joint Diseases Inventory Management Department,Sengkang,2600,6/23/2011,Theft,Paper,2014-06-20,"A box containing 2,600 paper records of tissue implants used in surgeries was discarded by a waste disposal contractor of the covered entity (CE), NYU Hospital for Joint Diseases Inventory Management Department, when the box was not property secured.  The box contained the protected health information (PHI) of 2,239 individuals and included names, dates of birth, dates of surgery, surgeon names, procedures, and types and serial numbers of the tissues used in the surgeries.  Upon discovery of the breach, the CE contacted the waste disposal contractor and determined that the documents were discarded and buried in a landfill out of state.  The CE provided breach notification to HHS, the media, and affected individuals, and posted substitute notice on its website.  As a result of OCR's investigation, the CE improved safeguards by storing all tissue records in a locked cabinet and requiring management to store the keys.  In addition, the CE counseled the employees involved in the incident and retrained all staff on its policies and procedures for safeguarding PHI.  The CE also implemented a plan to conduct reviews of HIPAA compliance, including both physical access and physical security risks.",2011-06-23,2011
272,273,WAYNE HIGHLANDS SCHOOL DISTRICT,Serangoon,579,2011-09-09 00:00:00,"Theft, Unauthorized Access/Disclosure",Paper,2014-06-10,,2011-09-09,2011
273,274,"Summit Medical Group, PLLC",Bishan,731,2011-04-09 00:00:00,Theft,Paper,2014-01-23,,2011-09-04,2011
274,275,MAPFRE Life,Ang Mo Kio,2209,2011-05-08 00:00:00,Theft,Other,2014-03-13,,2011-08-05,2011
275,276,American Continental Insurance Company,Bishan,690,7/28/2011,Theft,"Other Portable Electronic Device, Other",2014-01-23,,2011-07-28,2011
276,277,United of Omaha Life Insurance Company,Bukit Batok,1631,7/28/2011,Loss,"Other Portable Electronic Device, Other",2014-01-23,,2011-07-28,2011
277,278,Mutual of Omaha Insurance Company,Bukit Batok,705,7/28/2011,Theft,"Other Portable Electronic Device, Other",2014-01-23,,2011-07-28,2011
