,Number,Name_of_Covered_Entity,Region,Individuals_Affected,Date_of_Breach,Type_of_Breach,Location_of_Breached_Information,Date_Posted_or_Updated,Summary,breach_start,year
0,1,Brooke Army Medical Center,Yishun,1000,10/16/2009,Theft,Paper,2014-06-30,"A binder containing the protected health information (PHI) of up to 1,272 individuals was stolen from a staff member's vehicle.  The PHI included names, telephone numbers, detailed treatment notes, and possibly social security numbers.  In response to the breach, the covered entity (CE) sanctioned the workforce member and developed a new policy requiring on-call staff members to submit any information created during their shifts to the main office instead of adding it to the binder.  Following OCR's investigation, the CE notified the local media about the breach.",2009-10-16,2009
1,2,"Mid America Kidney Stone Association, LLC",Queenstown,1000,9/22/2009,Theft,Network Server,2014-05-30,"Five desktop computers containing unencrypted electronic protected health information (e-PHI) were stolen from the covered entity (CE).  Originally, the CE reported that over 500 persons were involved, but subsequent investigation showed that about 260 persons were involved.  The ePHI included demographic and financial information. The CE provided breach notification to affected individuals and HHS.  Following the breach, the CE improved physical security by installing motion detectors and alarm systems security monitoring.  It improved technical safeguards by installing enhanced antivirus and encryption software.  As a result of OCR's investigation the CE updated its computer password policy.  ",2009-09-22,2009
2,3,Alaska Department of Health and Social Services,Woodlands,501,2009-12-10 00:00:00,Theft,"Other Portable Electronic Device, Other",2014-01-23,,2009-10-12,2009
3,4,"Health Services for Children with Special Needs, Inc.",Tampines,3800,2009-09-10 00:00:00,Loss,Laptop,2014-01-23,"A laptop was lost by an employee while in transit on public transportation.  The computer contained the protected health information of 3800 individuals.  The protected health information involved in the breach included names, Medicaid ID numbers, dates of birth, and primary physicians.  In response to this incident, the covered entity took steps to enforce the requirements of the Privacy & Security Rules.  The covered entity has installed encryption software on all employee computers, strengthened access controls including passwords, reviewed and updated security policies and procedures, and updated it risk assessment.  In addition, all employees received additional security training.  ",2009-10-09,2009
4,5,"Cogent Healthcare of Wisconsin, S.C.",Bishan,6400,2009-11-10 00:00:00,Theft,Laptop,2014-04-23,"A laptop was stolen from a locked office at the Aurora St. Lukes Medical Center.  The laptop contained protected health information pertaining to 6,400 individuals.  The information included patient names, dates of birth, social security numbers, medical record numbers, and in some cases diagnosis codes.  In response to the theft, the hospital implemented several corrective action measures, including accelerated efforts to encrypt all laptop hard drives, improved physical locks on the office where the theft occurred, staff training regarding the appropriate use and storage of devices containing ePHI, and encryption of portable flash drives and Blackberry devices.",2009-10-11,2009
5,6,Universal American,Sengkang,83000,2009-12-11 00:00:00,Other,Paper,2014-01-23,"In its breach report and during the course of OCR's investigation, the covered entity advised that it took various corrective actions to prevent a reoccurrence of the breach.  Specifically, the covered entity conducted a risk assessment which revealed that the breach posed a significant risk of financial, reputational, or other harm to the 83,000 members.  The covered entity sent notification letters to 83,000 members apologizing for the breach and offered a year of free credit monitoring and a $25,000 insurance policy against identity theft ($10,000 for New York residents).  The covered entity also provided training to its call centers on November 29, 2009 to answer inquiries from callers concerned about the breach.  In addition, media outlets were contacted to alert of a breach in states in which more than 500 members were impacted by the breach.  The covered entity advised that media outlets were identified based on location of membership impacted, as well as ensuring it was a major media outlet and press releases were sent to 21 major media outlets on December 18, 2009.  The covered entity also created and implemented a new policy titled 'Personal Health Information and Personal Identifiable Information Data Security and Handling Policy Acknowledgement Form'  that centralized all data requests through a 'Team Track'  which is an internal electronic submission request that ensures all PHI requested data receives the sign off of the Privacy Officer and Security Officer prior to release.  Further, the covered entity also provided a mandatory annual computer-based training to all staff in May 2010.",2009-11-12,2009
6,7,"Keith W. Mann, DDS, PLLC",Bukit Panjang,2000,2009-08-12 00:00:00,Hacking/IT Incident,"Desktop Computer, Network Server, Electronic Medical Record",2014-01-23,,2009-12-08,2009
7,8,Detroit Department of Health and Wellness Promotion,Newton,10000,10/22/2009,Theft,Other Portable Electronic Device,2014-01-23,,2009-10-22,2009
8,9,Detroit Department of Health and Wellness Promotion,Newton,646,11/26/2009,Theft,"Laptop, Desktop Computer",2014-01-23,"A desktop and four laptop computers were stolen from the covered entity's locked facility.  The protected health information involved in the breach included names, addresses, dates of birth, social security numbers, types of services received, and Medicare/Medicaid numbers.Following the breach, the covered entity installed new office door locks with assigned keys, installed security cameras with alarms, and physically secured computers to desks.  The covered entity now stores billing information in its patient management system, and it ensured that no electronic protected health information was stored locally. Additionally, OCR's investigation resulted in the covered entity providing training to workforce members regarding the incident",2009-11-26,2009
9,10,Daniel J. Sigman MD PC,Paya Lebar,1860,2009-11-12 00:00:00,Theft,"Other Portable Electronic Device, Other, Electronic Medical Record",2014-01-23,"Computer backup tapes containing EPHI for the office practice management program including electronic medical records were stolen from the home of the practice manager on December 11, 2009.   The breach affected approximately 1,860 patients. The protected health information on the tapes contained patients' names, addresses, telephone numbers, dates of birth, insurance information, social security numbers and medical record information.  Following the breach, Sigman took the following voluntary corrective actions: (1) upgraded software application for backup security",2009-12-11,2009
10,11,BlueCross BlueShield Association,Tampines,3400,10/26/2009,Theft,Paper,2014-06-30,"The covered entity's (CE) business associate (BA) incorrectly updated contract holders' addresses and mailed protected health information (PHI) to the wrong address of approximately 3,400 individuals.  The PHI involved included demographic information, explanations of benefits, clinical information, and diagnoses.  The breach incident involved a BA and occurred prior to the September 23, 2013, compliance date.  Upon discovery of the breach, the CE obtained assurances that the BA took steps to enforce the requirements of the BA agreement.  Specifically, the BA updated its processes and created an incident tracking report.  In addition, a contract was executed for a new vendor to handle mail address verification. Following OCR's investigation, the BA improved its code review process to catch the system error that caused this incident and instituted a manual quality review process.  OCR verified that the CE had a proper BA agreement in place that restricted the BA's use and disclosure of PHI and required the BA to safeguard all PHI.",2009-10-26,2009
11,12,Kaiser Permanente Medical Care Program,Yio Chu Kang,15500,2009-01-12 00:00:00,Theft,"Other Portable Electronic Device, Other",2014-01-23,,2009-12-01,2009
12,13,Blue Island Radiology Consultants,Boon Lay,2562,2009-09-12 00:00:00,Theft,Other,2014-06-30,The covered entity's (CE's) business associate (BA) mailed a package to the CE that was supposed to contain a backup data tape and compact disc containing protected health information (PHI),2009-12-09,2009
13,14,Concentra,Yishun,900,11/19/2009,Theft,Laptop,2014-01-23,,2009-11-19,2009
14,15,Ashley and Gray DDS,Queenstown,9309,2010-10-01 00:00:00,Theft,Desktop Computer,2014-01-23,,2010-01-10,2010
15,16,Advocate Health Care,Boon Lay,812,11/24/2009,Theft,Laptop,2014-01-23,"On November 24, 2009, an Advocate nurse's laptop computer was stolen.  The missing laptop computer contained the protected health information of approximately 812 individuals.  The protected health information involved in the breach included name, address, dates of birth, social security numbers, insurance information, medication, and diagnoses. Following the breach, Advocate specifically addressed mobile device security and accepted use. Additionally, OCR's investigation resulted in Advocate workforce members that use mobile devices are now required to fill out and submit an acknowledgment form that establish proper administrative, technical, and physical security safeguards.  ",2009-11-24,2009
16,17,Carle Clinic Association,Boon Lay,1300,1/13/2010,Theft,"Other, Paper",2014-01-23,,2010-01-13,2010
17,18,Educators Mutual Insurance Association of Utah ,Farrer Park,5700,12/27/2009,Theft,Other,2014-01-23,,2009-12-27,2009
18,19,University Medical Center of Southern Nevada,Hougang,5103,10/31/2009,Theft,Paper,2014-01-23,"Between the dates of July 31, 2009 and November 19, 2009, a former UMC volunteer faxed patient face sheets to an attorney who used the sheets to contact prospective clients.  Although UMC only had proof of two disclosures, it chose to notify all 5,301 individuals that could have been affected by the breach.  The protected health information involved in the breach included names, addresses, dates of birth, social security numbers, and diagnoses.  Following the breach, UMC conducted an internal investigation, notified all 5,301 individuals, notified the media, and notified the Secretary.  Additionally, UMC reformulated face sheets so that they no longer include full social security numbers and provided all possible affected individuals with a year of free credit monitoring.  As a result of this breach, at least one person has been indicted on one count of conspiracy to illegally disclose personal health information in violation of the HIPAA",2009-10-31,2009
19,20,Brown University,Pasir Ris,528,2009-11-12 00:00:00,Other,Paper,2014-01-23,"On January 5, 2010, BCBSRI was notified that a 16 page report pertaining to Brown University's health plan was impermissibly disclosed to two other BCBSRI agents.  The reports contained the PHI of approximately 528 individuals.  The PHI involved: first and last names, dates of service, cost of medical care provided, and member identification numbers.  Following the breach, BCBSRI recovered the reports, received written assurances that any electronic copies of the reports were deleted, notified affected individuals of the breach, implemented new procedure for all outgoing correspondence, and is in the process of auditing all affected members' claim history to ensure no fraud.",2009-12-11,2009
20,21,University of New Mexico Health Sciences Center,Choa Chu Kang,1900,2010-08-02 00:00:00,Other,Desktop Computer,2014-01-23,,2010-02-08,2010
21,22,Advanced NeuroSpinal Care,Yio Chu Kang,3500,12/30/2009,Theft,Network Server,2014-04-22,"A computer containing the electronic protected health information (ePHI) of 3,500 individuals was stolen from the office of a covered entity (CE).  The ePHI included patient names, addresses, dates of birth, social security numbers, driver's licenses, claims information, diagnoses, and conditions. As a result of the loss, the CE upgraded the alarm system and replaced the server housing and storage security lock-up.  The CE also notified affected individuals, the media, appropriate government agencies, and law enforcement.  In addition, the CE established an office-based hotline to assist affected individuals.  As a result of OCR's investigation, the CE has implemented regularly scheduled security risk analyses and has installed window bars, roll down shutters, four video surveillance cameras, and other physical security measures to prevent theft.",2009-12-30,2009
22,23,Aspen Dental Care P.C.,Redhill,2500,2009-04-10 00:00:00,Theft,Other,2014-06-30,"A computer hard drive containing encrypted patient records was stolen from the covered entity's (CE) safe.  The hard drive contained clinical and demographic information of approximately 2,500 patients.  Following the breach, the CE provided additional training to its staff.  OCR obtained assurances that the CE implemented the corrective action listed above.",2009-10-04,2009
23,24,Thrivent Financial for Lutherans,Simei,9500,1/29/2010,Theft,Laptop,2014-01-23,"On January 29, 2010, there was a break-in at one of the Thrivent's offices and five laptop computers were stolen",2010-01-29,2010
24,25,Montefiore Medical Center,Sengkang,625,2/20/2010,Theft,Laptop,2014-06-03,"An unencrypted laptop computer containing the electronic protected health information (ePHI) of 625 individuals was stolen from the covered entity's (CE) mobile dental van.  The ePHI included names, dates of birth, medical record numbers and dental x-rays.  Upon discovery of the breach, the CE filed a police report and provided breach notification to HHS, the media and affected individuals.  As a result of OCR's investigation, the CE revised its procedures so that all ePHI is stored in a data center, rather than the mobile dental van laptop.  In addition, the CE encrypted all mobile dental van laptops and improved physical security for the van.  The CE developed a new policy on ePHI security and retrained all staff.  OCR obtained assurances that the CE implemented the corrective action listed above.",2010-02-20,2010
25,26,"Ernest T. Bice, Jr. DDS, P.A.",Yishun,21000,2/20/2010,Theft,"Other Portable Electronic Device, Other",2014-01-23,"Three unencrypted external back-up drives were stolen from a safe in the covered entity's locked office.  The laptop computer contained the protected health information of approximately 21,000 individuals.  The protected health information involved in the breach included names, addresses phone numbers, dates of birth, social security numbers, insurance information, and treatment histories.  Following the breach, the covered entity moved back-up data offsite and encrypted all workstations.  Additionally, OCR's investigation resulted in the covered entity improving their physical safeguards and in retraining employees.",2010-02-20,2010
26,27,Griffin Hospital,Admiralty,957,2010-04-02 00:00:00,Hacking/IT Incident,Network Server,2014-01-23,,2010-02-04,2010
27,28,"Hypertension, Nephrology, Dialysis and Transplantation, PC",Clementi,2465,2010-06-03 00:00:00,Theft,Laptop,2014-01-23,,2010-03-06,2010
28,29,Reliant Rehabilitation Hospital North Houston,Yishun,768,2010-09-02 00:00:00,Unauthorized Access/Disclosure ,E-mail,2014-01-23,,2010-02-09,2010
29,30,"Laboratory Corporation of America / US LABS / Dianon Systems, Inc",Toa Payoh,2773,2/18/2010,Theft,Other Portable Electronic Device,2014-01-23,,2010-02-18,2010
30,31,University of Pittsburgh Student Health Center,Serangoon,8000,2010-11-03 00:00:00,"Theft, Loss",Paper,2014-01-23,,2010-03-11,2010
31,32,Providence Hospital,Newton,83945,2010-04-02 00:00:00,Other,Other,2014-01-23,,2010-02-04,2010
32,33,VHS Genesis Lab Inc. ,Boon Lay,6800,2010-10-01 00:00:00,Loss,Paper,2014-01-23,,2010-01-10,2010
33,34,John Muir Physician Network,Yio Chu Kang,5450,2010-04-02 00:00:00,Theft,Laptop,2014-01-23,,2010-02-04,2010
34,35,Beatrice Community Hospital and Health Center,Bukit Batok,660,3/19/2010,Other,Paper,2014-01-23,,2010-03-19,2010
35,36,Pediatric Sports and Spine Associates,Yishun,955,2010-10-02 00:00:00,Theft,Laptop,2014-01-23,"An unencrypted laptop was stolen from an employee's vehicle.  The laptop contained the protected health information of approximately 955 individuals.  The protected health information involved in the breach included names, addresses, dates of birth, social security numbers, diagnoses, medications and other treatment information.  Following the discovery of the breach, the covered entity revised policies, retrained staff and implemented additional physical and technical safeguards including encryption software.  The covered entity also removed the stolen laptop's access to the server, sanctioned the involved employee, notified the affected individuals and notified the local media.  ",2010-02-10,2010
36,37,Tomah Memorial Hospital,Simei,600,3/19/2010,Other,Other,2014-01-23,,2010-03-19,2010
37,38,"Praxair Healthcare Services, Inc. (Home Care Supply in NY)",Admiralty,54165,2/18/2010,Theft,Laptop,2014-01-23,"A laptop computer was stolen from the covered entity's office by a former employee after it had been damaged. The laptop computer contained the PHI of approximately 54,165 individuals.  The computer contained a limited amount of PHI, including client names and one or more of the following: addresses, phone numbers, social security numbers, insurance provider names and policy numbers, medical diagnostic codes or medical equipment.  Following the breach, the covered entity notified all affected individuals, the media, and HHS of the breach. Additionally, the covered entity completed its laptop encryption project to cover all PHI stored on computers in the office.  Additionally, OCR's investigation resulted in the covered entity reinforcing the requirements of HIPAA to its employees.",2010-02-18,2010
38,39,Blue Cross & Blue Shield of Rhode Island,Pasir Ris,12000,12/20/2009,Theft,Paper,2014-06-30,"A covered entity (CE) donated a file cabinet containing the protected health information (PHI) of 12,000 individuals before cleaning it out.  The PHI included members' names, addresses, telephone numbers, social security numbers, and Medicare identification numbers.  The covered entity (CE) provided breach notification to HHS, the affected individuals, and media, and offered all affected individuals free credit monitoring for a period of one year.  Following the breach, the CE sanctioned the employees involved in the incident and held a mandatory training regarding the HIPAA Privacy and Security Rule for all departments involved in the breach. The CE also revised the policy for office moves.  OCR obtained assurances that the CE implemented the corrective action listed above.",2009-12-20,2009
39,40,St. Joseph Heritage Healthcare,Yio Chu Kang,22012,2010-06-03 00:00:00,Theft,Desktop Computer,2014-01-23,"22 computers were stolen from Clinical Management Service office.Five of the stolen computers contained the protected health information of approximately 22,012 individuals. The protected health information involved in the breach included name, date of birth, social security number, referral number, encounter number, facility, member ID, diagnosis, procedure, and/or diagnosis code. As a result of this incident, St. Joseph notified the potentially affected individuals, notified the local media, installed security cameras, re-trained employees, and installed encryption software on all laptops and Computers enterprise-wide. OCR's investigation resulted in the covered entity improving their physical and technological safeguards and retraining employees.",2010-03-06,2010
40,41,GENERAL AGENCIES WELFARE BENEFITS PROGRAM,Bishan,1874,2010-05-02 00:00:00,Loss,Other,2014-01-23,,2010-02-05,2010
41,42,UnitedHealth Group health plan single affiliated covered entity,Chai Chee,735,2010-02-03 00:00:00,Theft,"Other, Paper",2014-01-23,,2010-03-02,2010
42,43,South Texas Veterans Health Care System,Yishun,1430,9/30/2009,"Loss, Improper Disposal",Paper,2014-01-23,,2009-09-30,2009
43,44,Rockbridge Area Community Services,Marine Parade,500,2010-12-03 00:00:00,Theft,"Laptop, Desktop Computer",2014-01-23,,2010-03-12,2010
44,45,"Emergency Healthcare Physicians, Ltd.",Boon Lay,180111,2/27/2010,Theft,"Other Portable Electronic Device, Other",2014-01-23,,2010-02-27,2010
45,46,VA Eastern Colorado Health Care System,Redhill,649,1/19/2010,Theft,Paper,2014-06-19,"A covered entity's (CE's) employee placed paper records containing protected health information (PHI) in an unsecured box that was left undiscovered in a public parking garage for four days.  The box contained the PHI of 649 patients.  The PHI included treatment records, productivity reports, coding information, names, medical treatments, conditions, diagnoses, and social security numbers.  Upon discovery of the breach, the CE notified the affected individuals and provided credit protection to those whose social security numbers had been breached.  The CE provided OCR with copies of its breach prevention policies and procedures. Following OCR's investigation, the employee who left the records resigned from her position and the CE improved its breach response procedures. ",2010-01-19,2010
46,47,Miami VA Healthcare System,Sembawang,568,1/19/2010,Loss,Paper,2014-01-23,,2010-01-19,2010
47,48,"Heriberto Rodriguez-Ayala, M.D.",Yishun,4200,2010-03-04 00:00:00,Theft,Laptop,2014-01-23,,2010-04-03,2010
48,49,Loma Linda University Health Care,Yio Chu Kang,584,2010-04-04 00:00:00,Theft,Desktop Computer,2014-01-23,,2010-04-04,2010
49,50,Veterans Health Administration,Tampines,656,4/22/2010,Theft,Laptop,2014-01-23,,2010-04-22,2010
50,51,"State of New Mexico Human Services Department, Medical Assistance Division",Choa Chu Kang,9600,3/20/2010,Theft,Laptop,2014-01-23,,2010-03-20,2010
51,52,Oconee Physician Practices,Little India,653,2010-09-05 00:00:00,Theft,Laptop,2014-01-23,,2010-05-09,2010
52,53,University of Rochester Medical Center and Affiliates,Sengkang,2628,4/19/2010,Other,Paper,2014-01-23,,2010-04-19,2010
53,54,Omaha Construction Industry Health and Welfare Plan,Bukit Batok,800,2009-11-01 00:00:00,Theft,Laptop,2014-01-23,,2009-01-11,2009
54,55,"City of Charlotte, NC (Health Plan)",Bukit Panjang,5220,2010-03-02 00:00:00,Loss,Other,2014-01-23,,2010-02-03,2010
55,56,VA North Texas Health Care System,Yishun,4083,2010-04-05 00:00:00,Improper Disposal,Paper,2014-01-23,,2010-05-04,2010
56,57,Occupational Health Partners,Alexandra,1105,2010-12-05 00:00:00,Theft,Laptop,2014-01-23,,2010-05-12,2010
57,58,"AvMed, Inc.",Sembawang,1220000,2009-10-12 00:00:00,Theft,Laptop,2014-06-30,"Two laptop computers with questionable encryption (each containing the electronic protected health information (ePHI) of 350,000 individuals) were stolen from the covered entity's (CE) premises.  The types of ePHI involved included demographic and clinical information, diagnoses/conditions, medications, lab results, and other treatment data.  After discovering the breach, the CE reported the theft to law enforcement and worked with the local police to recover the laptops.  As a result of OCR's investigation, the CE developed and implemented new policies and procedures to comply with the Security Rule.  The CE also provided breach notification to all affected individuals, HHS, and the media and placed an accounting of disclosures in the medical records of all affected individuals.",2009-12-10,2009
58,59,St. Jude Children's Research Hospital,Bishan,1745,4/19/2010,Loss,Laptop,2014-01-23,,2010-04-19,2010
59,60,Comprehensive Care Management Corporation,Sengkang,1020,4/30/2010,Theft,"Laptop, Desktop Computer, Network Server, E-mail",2014-06-19,"OCR opened an investigation of the covered entity (CE), Comprehensive Care Management Corporation, after it reported two former employees sent emails that contained the electronic protected health information (ePHI) of 1,020 individuals to their personal email accounts to open a competitor organization.  The ePHI included names, addresses, and enrollment information.  Upon discovery of the breach, the CE conducted an internal inquiry and found that the former employees disclosed the ePHI to its competitor.  As a result of OCR's investigation, the CE replaced and strengthened external firewalls, restricted access to email websites, restricted the use of portable devices, limited the ability to upload data to external websites, and evaluated new monitor and control software for network information.  In addition, the CE provided training to all staff on its HIPAA policies and procedures.  The CE also entered into an agreement with its competitor who hired the former employees to return or destroy the ePHI.",2010-04-30,2010
60,61,alma aguado md pa,Yishun,600,5/29/2010,Theft,Network Server,2014-04-23,"OCR investigated the covered entity (CE) following a report that its main server and desktop computers containing the electronic protected health information (ePHI) of 600 individuals were taken from the CE's office.  The ePHI involved in the breach included patient names, addresses, dates of birth, and social security numbers.  As a result of OCR's investigation, the CE changed its privacy and security policies, retrained its employees and provided additional physical security to better safeguard patient ePHI.",2010-05-29,2010
61,62,University Hospital,Eunos,14000,2010-07-05 00:00:00,Loss,Other,2014-01-23,,2010-05-07,2010
62,63,University Health System,Hougang,7526,2010-11-06 00:00:00,Theft,Network Server,2014-01-23,,2010-06-11,2010
