/2019-summer-Birkenstock-slippers-Toe-Scrub-Brown-woman-men-slippers-sandals-Size-34-45-i.170051111.2656884504,2019 summer Birkenstock slippers Toe Scrub Brown woman men slippers sandals Size 34-45,$45.50 ,$91.00 ,50% off,No Bundles Avaliable,Free shipping for orders over $20,$0.00 ,0,Birkenstock,No Ratings Yet,0,0,0,jinleis.sg,0,982,57%,within hours,33 days ago,1
/birkenshock-bo-ken-word-slippers-white-men-and-women-lovers-i.163496159.2656564769,birkenshock bo ken word slippers white men and women lovers,$63.55 ,No Discount,No Discount,No Bundles Avaliable,No Free Shipping,$0.00 - $1.00,0,No Brand,No Ratings Yet,0,0,0,nro6.sip.sg,0,49,67%,within hours,59 days ago,0
/0-1-2-years-old-baby-single-men-and-women-in-spring-summer-infant-baotou-snea-i.130105791.2655935010,0-1-2 years old baby single men and women in spring summer infant baotou snea,$10.50 - $11.20,$15.00 - $16.00,30% off,No Bundles Avaliable,Free shipping for orders over $20,$0.00 - $1.00,0,No Brand,No Ratings Yet,0,0,0,donnaoa.sg,6,1075,29%,within hours,7 months ago,2
/Wang-wang's-slippers-children-1-to-3-years-old-men-and-women-baby-infant-soft-i.130105791.2655900527,Wang wang's slippers children 1 to 3 years old men and women baby infant soft,$9.23 - $9.94,$13.00 - $14.00,29% off,No Bundles Avaliable,Free shipping for orders over $20,$0.00 - $1.00,0,No Brand,No Ratings Yet,0,0,0,donnaoa.sg,6,1075,29%,within hours,7 months ago,2
/2019-Birkenstock-Two-Buckle-Anti-fur-Navy-Blue-Men-Women-Fashion-Summer-Slippers-i.170051111.2655807409,2019 Birkenstock Two Buckle Anti-fur Navy Blue Men Women Fashion Summer Slippers,$46.50 ,$93.00 ,50% off,No Bundles Avaliable,Free shipping for orders over $20,$0.00 ,0,Birkenstock,No Ratings Yet,0,0,0,jinleis.sg,0,982,57%,within hours,33 days ago,1
/2019-summer-new-simple-flat-rubber-slipper-slippers-men-and-women-Korean-version-i.106755295.2652306053,2019 summer new simple flat rubber slipper slippers men and women Korean version,$12.50 ,No Discount,No Discount,No Bundles Avaliable,Free shipping for orders over $20,$0.00 - $1.00,0,No Brand,No Ratings Yet,0,0,0,huizhan3.sg,1,678,100%,within hours,10 months ago,0
/2019-summer-new-style-slippers-men-and-women-trend-Korean-sandals-couple-models-i.106755295.2652298271,2019 summer new style slippers men and women trend Korean sandals couple models,$19.00 ,No Discount,No Discount,No Bundles Avaliable,Free shipping for orders over $20,$0.00 - $1.00,0,No Brand,No Ratings Yet,0,0,0,huizhan3.sg,1,678,100%,within hours,10 months ago,0
/men-and-women-beach-wading-shoes-snorkel-folding-slippers-i.162301499.2652235254,men and women beach wading shoes snorkel folding slippers,$16.32 ,No Discount,No Discount,No Bundles Avaliable,Free shipping for orders over $20,$0.00 - $1.00,0,No Brand,No Ratings Yet,0,0,0,bevd.sip.sg,0,744,57%,within hours,2 months ago,0
/huangzhong-11-heavy-(texture)-men-essential-summer-new-sandals-men's-slippers-i.163107294.2652199148,huangzhong 11 heavy (texture) men essential summer new sandals men's slippers,$20.80 ,No Discount,No Discount,No Bundles Avaliable,Free shipping for orders over $20,$0.00 ,0,No Brand,No Ratings Yet,0,0,0,gn3i.sip.sg,0,2150,57%,within hours,2 months ago,0
/huangzhong-11-heavy-best-quality-men-essential-summer-bathroom-fashion-slippers-i.163107294.2652192539,huangzhong 11 heavy best quality men essential summer bathroom fashion slippers,$16.20 ,No Discount,No Discount,No Bundles Avaliable,Free shipping for orders over $20,$0.00 - $1.00,0,No Brand,No Ratings Yet,0,0,0,gn3i.sip.sg,0,2150,57%,within hours,2 months ago,0
/huangzhong-11-heavy-best-quality-men-essential-two-summer-couple-slippers-i.163107294.2652191069,huangzhong 11 heavy best quality men essential two summer couple slippers,$24.01 ,No Discount,No Discount,No Bundles Avaliable,Free shipping for orders over $20,$0.00 ,0,No Brand,No Ratings Yet,0,0,0,gn3i.sip.sg,0,2150,57%,within hours,2 months ago,0
/hangzhong-11-heavy-best-quality-men-essential-two-summer-men-printed-slippers-i.163107294.2652187330,hangzhong 11 heavy best quality men essential two summer men printed slippers,$20.80 ,No Discount,No Discount,No Bundles Avaliable,Free shipping for orders over $20,$0.00 ,0,No Brand,No Ratings Yet,0,0,0,gn3i.sip.sg,0,2150,57%,within hours,2 months ago,0
/hangzhong-11-heavy-texture-men-essential-summer-students-slippers-i.163107294.2652175598,hangzhong 11 heavy texture men essential summer students slippers,$28.61 ,No Discount,No Discount,No Bundles Avaliable,Free shipping for orders over $20,$0.00 ,0,No Brand,No Ratings Yet,0,0,0,gn3i.sip.sg,0,2150,57%,within hours,2 months ago,0
/Shoe-buckle-hole-shoes-child-female-sandals-children-accessories-slippers-men-a-i.155109266.2651767152,Shoe buckle hole shoes child female sandals children accessories slippers men a,$5.00 ,No Discount,No Discount,No Bundles Avaliable,Free shipping for orders over $20,$0.00 - $1.00,0,MY Collection,No Ratings Yet,0,0,0,sdfadt5.sg,0,15,57%,within hours,3 months ago,1
/slippers-men-outdoor-personality-cool-i.160361944.2651666801,slippers men outdoor personality cool,$54.15 ,No Discount,No Discount,No Bundles Avaliable,Free shipping for orders over $20,$0.00 ,0,No Brand,No Ratings Yet,0,0,0,htzt.sip.sg,0,1749,57%,within days,2 months ago,0
/half-slippers-men-cool-drag-breathable-i.160361944.2651647937,half slippers men cool drag breathable,$54.15 ,No Discount,No Discount,No Bundles Avaliable,Free shipping for orders over $20,$0.00 ,0,No Brand,No Ratings Yet,0,0,0,htzt.sip.sg,0,1749,57%,within days,2 months ago,0
/slippers-men-wear-sandals-day-outdoor-i.160361944.2651644809,slippers men wear sandals day outdoor,$54.15 ,No Discount,No Discount,No Bundles Avaliable,Free shipping for orders over $20,$0.00 ,0,No Brand,No Ratings Yet,0,0,0,htzt.sip.sg,0,1749,57%,within days,2 months ago,0
/slippers-men-wear-drag-soft-bottom-non-slip-outdoor-beach-canvas-i.160361944.2651642221,slippers men wear drag soft bottom non-slip outdoor beach canvas,$54.15 ,No Discount,No Discount,No Bundles Avaliable,Free shipping for orders over $20,$0.00 ,0,No Brand,No Ratings Yet,0,0,0,htzt.sip.sg,0,1749,57%,within days,2 months ago,0
/men-summer-new-letter-sandals-slippers-beach-shoes-i.163488340.2650566768,men summer new letter sandals slippers beach shoes,$11.67 ,$19.62 ,41% off,No Bundles Avaliable,Free shipping for orders over $20,$0.00 - $1.00,0,No Brand,No Ratings Yet,0,0,0,m413.sip.sg,0,202,42%,within hours,59 days ago,0
/Showme-Women-Men-Unsexy-Warm-Flower-Slipper-Indoors-Anti-slip-Winter-House-Shoes-i.149744189.2650393752,Showme Women Men Unsexy Warm Flower Slipper IndoorsAnti-slip Winter House Shoes,$4.01 ,$8.02 ,50% off,Any 2 enjoy 1% off,Free shipping for orders over $20,$0.00 - $1.00,0,No Brand,No Ratings Yet,0,0,0,showme1.sg,13,868,67%,within hours,4 months ago,80
/Showme-Women-Men-Warm-Slipper-Indoors-Anti-slip-Winter-House-Shoes-i.149744189.2650393721,Showme Women Men Warm Slipper IndoorsAnti-slip Winter House Shoes,$5.12 ,$10.25 ,50% off,Any 2 enjoy 1% off,Free shipping for orders over $20,$0.00 - $1.00,0,No Brand,No Ratings Yet,0,0,0,showme1.sg,13,868,67%,within hours,4 months ago,80
/Showme-Women-Men-Warm-Slipper-Indoors-Anti-slip-Winter-House-Shoes-i.149744189.2650393700,Showme Women Men Warm Slipper IndoorsAnti-slip Winter House Shoes,$3.52 ,$7.04 ,50% off,Any 2 enjoy 1% off,Free shipping for orders over $20,$0.00 - $1.00,0,No Brand,No Ratings Yet,0,0,0,showme1.sg,13,868,67%,within hours,4 months ago,80
/2019-Slippers-Summer-Men-Fashion-Sandals-Beach-Shoes-i.145273261.2649370451,2019 Slippers Summer Men Fashion Sandals Beach Shoes,$19.00 ,$38.00 ,50% off,No Bundles Avaliable,Free shipping for orders over $20,$0.00 - $1.00,0,No Brand,No Ratings Yet,0,0,0,drg.sg,36,297,95%,within hours,4 months ago,389
/Fashion-Man-Beach-Shoes-Water-Shoes-Outdoor-Sandals-Slippers-i.145273261.2649370449,Fashion Man Beach Shoes Water Shoes Outdoor Sandals Slippers,$19.00 ,$38.00 ,50% off,No Bundles Avaliable,Free shipping for orders over $20,$0.00 - $1.00,0,No Brand,No Ratings Yet,0,0,0,drg.sg,36,297,95%,within hours,4 months ago,389
/new-sandals-and-slippers-men-Comfort-beach-slippers40-45-large-size-2019-i.145273261.2649370394,new sandals and slippers men Comfort beach slippers40--45 large size 2019,$19.00 ,$38.00 ,50% off,No Bundles Avaliable,Free shipping for orders over $20,$0.00 - $1.00,0,No Brand,No Ratings Yet,0,0,0,drg.sg,36,297,95%,within hours,4 months ago,389
/2019-Summer-Men-Beach-Sandal-Men-Sandals-Super-Light-Weight-Slippers-i.145273261.2649370339,2019 Summer Men Beach Sandal Men Sandals Super Light Weight Slippers,$19.00 ,$38.00 ,50% off,No Bundles Avaliable,Free shipping for orders over $20,$0.00 - $1.00,0,No Brand,No Ratings Yet,0,0,0,drg.sg,36,297,95%,within hours,4 months ago,389
/men-hole-cool-slippers-non-slip-breathable-men's-cool-slippers-i.162307152.2648349501,men hole cool slippers non-slip breathable men's cool slippers,$15.66 ,No Discount,No Discount,No Bundles Avaliable,Free shipping for orders over $20,$0.00 - $1.00,0,No Brand,No Ratings Yet,0,0,0,cstx.sip.sg,0,145,57%,within hours,2 months ago,0
/men-and-women-shoes-beach-shoes-cool-slippers-i.157606171.2647682789,men and women shoes/beach shoes cool slippers,$16.95 ,$22.15 ,23% off,No Bundles Avaliable,Free shipping for orders over $20,$0.00 - $1.00,0,No Brand,No Ratings Yet,0,0,0,l6bs.sip.sg,0,461,92%,within hours,3 months ago,0
/2019-summer-new-slippers-men-and-women-non-slip-soft-bottom-word-drag-couple-mod-i.106755248.2646866658,2019 summer new slippers men and women non-slip soft bottom word drag couple mod,$14.00 ,No Discount,No Discount,No Bundles Avaliable,No Free Shipping,$0.00 ,0,No Brand,No Ratings Yet,0,0,0,jingran3.sg,9,2940,85%,within hours,10 months ago,7
/2019-new-sandals-and-slippers-summer-breathable-daily-slippers-men-and-women-spo-i.106755248.2646865249,2019 new sandals and slippers summer breathable daily slippers men and women spo,$15.50 ,No Discount,No Discount,No Bundles Avaliable,No Free Shipping,$0.00 ,0,No Brand,No Ratings Yet,0,0,0,jingran3.sg,9,2940,85%,within hours,10 months ago,7
/Sandals-and-slippers-men-2019-summer-new-Korean-version-of-the-non-slip-trend-sa-i.106755248.2646863337,Sandals and slippers men 2019 summer new Korean version of the non-slip trend sa,$44.50 ,No Discount,No Discount,No Bundles Avaliable,No Free Shipping,$0.00 ,0,No Brand,No Ratings Yet,0,0,0,jingran3.sg,9,2940,85%,within hours,10 months ago,7
/Slippers-men-2019-summer-new-Korean-version-of-the-trend-of-non-slip-beach-shoes-i.106755264.2646838166,Slippers men 2019 summer new Korean version of the trend of non-slip beach shoes,$19.50 ,No Discount,No Discount,No Bundles Avaliable,No Free Shipping,$0.00 ,0,No Brand,No Ratings Yet,0,0,0,jingran1.sg,5,2107,100%,within hours,10 months ago,7
/Slippers-men-2019-summer-fashion-wear-a-word-drag-trend-men's-outdoor-casual-san-i.106755264.2646828116,Slippers men 2019 summer fashion wear a word drag trend men's outdoor casual san,$19.50 ,No Discount,No Discount,No Bundles Avaliable,No Free Shipping,$0.00 ,0,No Brand,No Ratings Yet,0,0,0,jingran1.sg,5,2107,100%,within hours,10 months ago,7
/Sandals-and-slippers-men-2019-summer-new-beach-sandals-men's-two-wear-fashion-we-i.106755264.2646818480,Sandals and slippers men 2019 summer new beach sandals men's two wear fashion we,$19.50 ,No Discount,No Discount,No Bundles Avaliable,No Free Shipping,$0.00 ,0,No Brand,No Ratings Yet,0,0,0,jingran1.sg,5,2107,100%,within hours,10 months ago,7
/2019-new-summer-trend-beach-sandals-outdoor-wild-casual-slippers-men-wear-a-word-i.106755297.2646647899,2019 new summer trend beach sandals outdoor wild casual slippers men wear a word,$29.50 ,No Discount,No Discount,No Bundles Avaliable,No Free Shipping,$0.00 ,0,No Brand,No Ratings Yet,0,0,0,huizhan2.sg,5,2774,100%,within hours,10 months ago,7
/2019-new-summer-trend-slippers-men-wearing-beach-sandals-outdoor-sandals-men-no-i.106755297.2646625100,2019 new summer trend slippers men wearing beach sandals outdoor sandals men no,$24.50 ,No Discount,No Discount,No Bundles Avaliable,No Free Shipping,$0.00 ,0,No Brand,No Ratings Yet,0,0,0,huizhan2.sg,5,2774,100%,within hours,10 months ago,7
/mijia-new-daily-wear-popular-home-couple-slippers-men-summer-female-fashion-i.142416198.2646012189,mijia new daily wear popular home couple slippers men summer female fashion,$8.86 ,No Discount,No Discount,No Bundles Avaliable,Free shipping for orders over $20,$0.00 - $1.00,0,No Brand,No Ratings Yet,0,0,0,b3ri.sip.sg,0,275,57%,within hours,5 months ago,0
/best-home-slippers-men-and-women-slippers-i.142416198.2646008183,best home slippers men and women slippers,$8.65 - $8.86,No Discount,No Discount,No Bundles Avaliable,Free shipping for orders over $20,$0.00 - $1.00,0,No Brand,No Ratings Yet,0,0,0,b3ri.sip.sg,0,275,57%,within hours,5 months ago,0
/Children's-cotton-slippers-5-winter-1-3-7-year-old-men-and-women-children-ca-i.130119922.2645191145,Children's cotton slippers 5 winter 1-3-7 - year old men and women children ca,$9.80 ,$14.00 ,30% off,No Bundles Avaliable,Free shipping for orders over $20,$0.00 - $1.00,0,No Brand,No Ratings Yet,0,0,0,meowsou03.sg,3,555,92%,within hours,6 months ago,0
/ready-stock-men-cool-slippers-summer-sandals-beach-outdoor-fashion-i.162534820.2644418717,ready stock men cool slippers summer sandals beach outdoor fashion,$36.83 ,$65.68 ,44% off,No Bundles Avaliable,Free shipping for orders over $20,$0.00 ,0,No Brand,No Ratings Yet,0,0,0,co4q.sip.sg,0,835,57%,within hours,2 months ago,0
/trend-personality-word-slippers-men-cool-slippers-i.161174792.2644154664,trend personality word slippers men cool slippers,$22.96 ,No Discount,No Discount,No Bundles Avaliable,Free shipping for orders over $20,$0.00 ,0,No Brand,No Ratings Yet,0,0,0,umlp.sip.sg,1,448,84%,within hours,2 months ago,0
/Men-Summer-Sandals-New-Adult-Outdoor-Beach-Sandals-Comfortable-Non-slip-Male-Water-Slippers-i.164780553.2644063367,Men Summer Sandals New Adult Outdoor Beach Sandals Comfortable Non-slip Male Water Slippers,$15.00 ,$25.00 ,40% off,No Bundles Avaliable,Free shipping for orders over $20,$0.00 - $1.00,0,No Brand,No Ratings Yet,0,0,0,mc8l668.sg,1,745,0%,within hours,54 days ago,0
/Man-camouflage-Flat-Bath-Slippers-Summer-Sandals-Indoor-and-Outdoor-Slippers-i.164780553.2644062024,Man camouflage Flat Bath Slippers Summer Sandals Indoor and Outdoor Slippers,$15.00 ,$25.00 ,40% off,No Bundles Avaliable,Free shipping for orders over $20,$0.00 - $1.00,0,No Brand,No Ratings Yet,0,0,0,mc8l668.sg,1,745,0%,within hours,54 days ago,0
/Men-Slippers-Casual-Non-slip-Indoor-and-Outdoor-Summer-Sandals-i.164780553.2644049567,Men Slippers Casual  Non-slip Indoor and Outdoor Summer  Sandals,$14.40 ,$24.00 ,40% off,No Bundles Avaliable,Free shipping for orders over $20,$0.00 - $1.00,0,No Brand,No Ratings Yet,0,0,0,mc8l668.sg,1,745,0%,within hours,54 days ago,0
/2017-summer-fashion-men-sandals-non-slip-soft-men-sandals-wear-resistant-slipper-i.163132926.2643503145,2017 summer fashion men sandals non-slip soft men sandals wear-resistant slipper,$15.67 ,No Discount,No Discount,No Bundles Avaliable,Free shipping for orders over $20,$0.00 - $1.00,0,No Brand,No Ratings Yet,0,0,0,kovr.sip.sg,1,2721,57%,within hours,2 months ago,1
/vietnam-sandals-men-slippers-sandals-open-toe-sandals-i.163132926.2643500482,vietnam sandals men slippers sandals open toe sandals,$15.67 ,No Discount,No Discount,No Bundles Avaliable,Free shipping for orders over $20,$0.00 - $1.00,0,No Brand,No Ratings Yet,0,0,0,kovr.sip.sg,1,2721,57%,within hours,2 months ago,1
/casual-sandals-breathable-dual-use-men-slippers-i.163132926.2643475289,casual sandals breathable dual-use men slippers,$19.21 ,No Discount,No Discount,No Bundles Avaliable,Free shipping for orders over $20,$0.00 - $1.00,0,No Brand,No Ratings Yet,0,0,0,kovr.sip.sg,1,2721,57%,within hours,2 months ago,1
/new-summer-slippers-sandals-men-trend-non-slip-casual-beach-shoes-i.163089764.2642843138,new summer slippers sandals men trend non-slip casual beach shoes,$16.91 ,No Discount,No Discount,No Bundles Avaliable,Free shipping for orders over $20,$0.00 - $1.00,0,No Brand,No Ratings Yet,0,0,0,ijdx.sip.sg,0,636,100%,within hours,2 months ago,0
/slippers-men-sandals-male-cool-drag-wear-i.162187365.2642721589,slippers men sandals male cool drag wear,$28.02 ,$33.68 ,17% off,No Bundles Avaliable,Free shipping for orders over $20,$0.00 ,0,No Brand,No Ratings Yet,0,0,0,atwa.sip.sg,0,1015,62%,within hours,2 months ago,0
/2019-new-leather-sandals-men-anti-skid-dual-use-cool-slippers-i.162187365.2642721051,2019 new leather sandals men anti-skid dual-use cool slippers,$28.02 ,$33.68 ,17% off,No Bundles Avaliable,Free shipping for orders over $20,$0.00 ,0,No Brand,No Ratings Yet,0,0,0,atwa.sip.sg,0,1015,62%,within hours,2 months ago,0
/the-road-the-camouflage-massage-slippers-men-sandals-i.162187365.2642720753,the road the camouflage massage slippers men sandals,$22.78 ,$26.78 ,15% off,No Bundles Avaliable,Free shipping for orders over $20,$0.00 ,0,No Brand,No Ratings Yet,0,0,0,atwa.sip.sg,0,1015,62%,within hours,2 months ago,0
/men-and-women-outdoor-couple-slippers-i.161666069.2642407597,men and women outdoor couple slippers,$26.10 ,No Discount,No Discount,No Bundles Avaliable,Free shipping for orders over $20,$0.00 ,0,No Brand,No Ratings Yet,0,0,0,ce77.sip.sg,6,50,0%,within days,2 months ago,1
/Slippers-men-2017-summer-new-wave-men's-slippers-Korean-version-of-the-word-drag-i.134313776.2642017186,Slippers men 2017 summer new wave men's slippers Korean version of the word drag,$23.00 - $25.00,No Discount,No Discount,No Bundles Avaliable,Free shipping for orders over $20,$0.00 ,0,No Brand,No Ratings Yet,0,0,0,chachaa2019.sg,2,2092,50%,within hours,6 months ago,0
/spring-and-autumn-men-and-women-leather-slippers-i.162307192.2641957038,spring and autumn men and women leather slippers,$22.35 ,No Discount,No Discount,No Bundles Avaliable,Free shipping for orders over $20,$0.00 ,0,No Brand,No Ratings Yet,0,0,0,bih7.sip.sg,0,603,61%,within hours,2 months ago,0
/cowhide-pack-scalp-slippers-summer-men-and-women-home-genuine-leather-slippers-i.162307192.2641953792,cowhide pack scalp slippers summer men and women home genuine leather slippers,$118.50 ,No Discount,No Discount,No Bundles Avaliable,Free shipping for orders over $20,$0.00 ,0,No Brand,No Ratings Yet,0,0,0,bih7.sip.sg,0,603,61%,within hours,2 months ago,0
/summer-men-and-women-fashion-leather-slippers-i.162307192.2641937659,summer men and women fashion leather slippers,$18.21 ,No Discount,No Discount,No Bundles Avaliable,Free shipping for orders over $20,$0.00 - $1.00,0,No Brand,No Ratings Yet,0,0,0,bih7.sip.sg,0,603,61%,within hours,2 months ago,0
/Wild-striped-slippers-female-summer-ins-couple-beach-sandals-and-slippers-men-i.76750353.2640106130,Wild striped slippers female summer ins couple beach sandals and slippers men,$13.63 ,No Discount,No Discount,No Bundles Avaliable,Free shipping for orders over $20,$0.00 - $1.00,0,No Brand,No Ratings Yet,0,0,0,huixiangmang.sg,8,2241,100%,within hours,15 months ago,6
/canvas-slippers-men-white-slippers-wear-sandals-i.160361944.2637331829,canvas slippers men white slippers wear sandals,$44.04 ,No Discount,No Discount,No Bundles Avaliable,Free shipping for orders over $20,$0.00 ,0,No Brand,No Ratings Yet,0,0,0,htzt.sip.sg,0,1749,57%,within days,2 months ago,0
/slippers-men-non-slip-beach-sports-casual-sandals-i.157004365.2637237723,slippers men non-slip beach sports casual sandals,$61.24 ,No Discount,No Discount,No Bundles Avaliable,Free shipping for orders over $20,$0.00 ,0,No Brand,No Ratings Yet,0,0,0,s9bb.sip.sg,1,1839,57%,within hours,3 months ago,0
/men's-sandals-summer-slippers-men-fashion-beach-dual-use-couple-wear-i.162520585.2636377934,men's sandals summer slippers men fashion beach dual-use couple wear,$19.29 ,No Discount,No Discount,No Bundles Avaliable,Free shipping for orders over $20,$0.00 - $1.00,0,No Brand,No Ratings Yet,0,0,0,snaf.sip.sg,0,698,75%,within hours,2 months ago,0
/jordan-slippers-jordan-break-slide-sandal-jordan-first-one-drag-men-and-women-fa-i.163094644.2636276981,jordan slippers jordan break slide sandal jordan first one drag men and women fa,$39.82 ,No Discount,No Discount,No Bundles Avaliable,No Free Shipping,$0.00 - $1.00,0,No Brand,No Ratings Yet,0,0,0,txjv.sip.sg,1,1,84%,within days,2 months ago,1
/couple-cool-slippers-men-and-women-slippers-i.162582496.2635513248,couple cool slippers men and women slippers,$13.57 ,$23.47 ,42% off,No Bundles Avaliable,Free shipping for orders over $20,$0.00 - $1.00,0,No Brand,No Ratings Yet,0,0,0,zclg.sip.sg,1,110,45%,within hours,2 months ago,0
/spot-universal-sandals-men-summer-2019-beach-couple-cool-slippers-i.163154342.2634774500,spot universal sandals men summer 2019 beach couple cool slippers,$31.63 ,No Discount,No Discount,No Bundles Avaliable,Free shipping for orders over $20,$0.00 ,0,No Brand,No Ratings Yet,0,0,0,a4ga.sip.sg,1,445,57%,within hours,2 months ago,0
/slippers-men-indoor-couple-sandals-soft-bottom-i.162818780.2634614765,slippers men indoor couple sandals soft bottom,$8.42 - $11.18,No Discount,No Discount,No Bundles Avaliable,Free shipping for orders over $20,$0.00 - $1.00,0,No Brand,No Ratings Yet,0,0,0,taqg.sip.sg,0,611,93%,within hours,2 months ago,0
/Men-Slippers-with-Flat-Non-slip-Sandals-i.164780553.2633999421,Men Slippers with Flat Non-slip Sandals,$13.80 ,$23.00 ,40% off,No Bundles Avaliable,Free shipping for orders over $20,$0.00 - $1.00,0,No Brand,No Ratings Yet,0,0,0,mc8l668.sg,1,745,0%,within hours,54 days ago,0
/Sandals-Hole-Shoes-Male-Clogs-Shoes-Sandals-Men-Slippers-i.164780553.2633961886,Sandals Hole Shoes Male Clogs Shoes Sandals Men Slippers,$9.00 ,$15.00 ,40% off,No Bundles Avaliable,Free shipping for orders over $20,$0.00 - $1.00,0,No Brand,No Ratings Yet,0,0,0,mc8l668.sg,1,745,0%,within hours,54 days ago,0
/Men-Shoes-Fashion-Summer-Beach-Home-Slippers-Outdoor-Anti-skidding-Slippers-i.164780553.2633958378,Men Shoes Fashion Summer Beach Home Slippers Outdoor Anti-skidding Slippers,$10.80 ,$18.00 ,40% off,No Bundles Avaliable,Free shipping for orders over $20,$0.00 - $1.00,0,No Brand,No Ratings Yet,0,0,0,mc8l668.sg,1,745,0%,within hours,54 days ago,0
/kudong-men-shoes-new-men's-slippers-cool-drag-lazy-i.156991700.2633892872,kudong men shoes new men's slippers cool drag lazy,$27.42 ,No Discount,No Discount,No Bundles Avaliable,Free shipping for orders over $20,$0.00 ,0,No Brand,No Ratings Yet,0,0,0,oy1r.sip.sg,1,808,82%,within days,3 months ago,1
/kudong-men's-shoes-slippers-men-casual-shoes-wear-i.156991700.2633861971,kudong men's shoes slippers men casual shoes wear,$20.27 ,No Discount,No Discount,No Bundles Avaliable,Free shipping for orders over $20,$0.00 ,0,No Brand,No Ratings Yet,0,0,0,oy1r.sip.sg,1,808,82%,within days,3 months ago,1
/Slippers-Men-Summer-Wear-resistant-Casual-Mans-Footwear-bathroom-slippers-i.164780553.2633857814,Slippers Men Summer Wear-resistant Casual Mans Footwear  bathroom slippers,$10.20 ,$17.00 ,40% off,No Bundles Avaliable,Free shipping for orders over $20,$0.00 - $1.00,0,No Brand,No Ratings Yet,0,0,0,mc8l668.sg,1,745,0%,within hours,54 days ago,0
/kudong-men's-shoes-men-slippers-trend-canvas-drag-slippers-i.156991700.2633841059,kudong men's shoes men slippers trend canvas drag slippers,$20.27 ,No Discount,No Discount,No Bundles Avaliable,Free shipping for orders over $20,$0.00 ,0,No Brand,No Ratings Yet,0,0,0,oy1r.sip.sg,1,808,82%,within days,3 months ago,1
/baotou-breathable-sandals-men-casual-hole-garden-slippers-i.163525326.2633794584,baotou breathable sandals men casual hole garden slippers,$21.21 ,No Discount,No Discount,No Bundles Avaliable,Free shipping for orders over $20,$0.00 ,0,No Brand,No Ratings Yet,0,0,0,a5qv.sip.sg,0,532,57%,within hours,59 days ago,0
/summer-bird's-nest-men-breathable-slippers-tide-couple-i.163525326.2633794316,summer bird's nest men breathable slippers tide couple,$18.13 ,No Discount,No Discount,No Bundles Avaliable,Free shipping for orders over $20,$0.00 - $1.00,0,No Brand,No Ratings Yet,0,0,0,a5qv.sip.sg,0,532,57%,within hours,59 days ago,0
/sandals-men-non-slip-2019-leather-thick-bottom-cool-slippers-i.163525326.2633790646,sandals men non-slip 2019 leather thick bottom cool slippers,$37.12 ,No Discount,No Discount,No Bundles Avaliable,Free shipping for orders over $20,$0.00 ,0,No Brand,No Ratings Yet,0,0,0,a5qv.sip.sg,0,532,57%,within hours,59 days ago,0
/sandals-male-2019-student-casual-shirt-men-cool-slippers-i.163525326.2633786601,sandals male 2019 student casual shirt men cool slippers,$26.91 ,No Discount,No Discount,No Bundles Avaliable,Free shipping for orders over $20,$0.00 ,0,No Brand,No Ratings Yet,0,0,0,a5qv.sip.sg,0,532,57%,within hours,59 days ago,0
/Summer-Men-Outdoor-Beach-Sandals-Boy-Bedroom-Slippers-Sup-Flat-Soft-Sandals-Flip-Flops-i.11271939.2633585924,Summer Men Outdoor Beach Sandals Boy Bedroom Slippers Sup Flat Soft Sandals Flip Flops,$12.00 ,$23.00 ,48% off,No Bundles Avaliable,Free shipping for orders over $20,$0.00 - $1.00,0,No Brand,No Ratings Yet,0,0,2,liweike.sg,2552,457,98%,within hours,35 months ago,2350
/Summer-new-young-men-and-women-0-2-years-old-baby-with-breathable-soft-botto-i.130105456.2632516386,Summer new young men and women 0-2 years old baby with breathable soft botto,$11.90 ,$17.00 ,30% off,No Bundles Avaliable,Free shipping for orders over $20,$0.00 - $1.00,0,No Brand,No Ratings Yet,0,0,1,niyanniyan.sg,4,533,64%,within hours,7 months ago,4
/Germany-genuine-ArizonaBirkenstock-double-buckle-men-and-women-shoes-couple-cork-sandals-and-slippers-i.163415354.2632238474,Germany genuine ArizonaBirkenstock double buckle men and women shoes couple cork sandals and slippers,$127.00 ,No Discount,No Discount,No Bundles Avaliable,No Free Shipping,$0.00 ,0,Birkenstock,No Ratings Yet,0,0,82,huant.sg,11,21,100%,within hours,60 days ago,19
