/Summer-Panther-Couple-Slippers-Cute-Women-Slippers-Men-Beach-Shoes-Gril-Shoes-i.11271939.1949509267,Summer Panther Couple Slippers Cute Women Slippers Men Beach Shoes Gril Shoes,$10.00 ,$12.00 ,17% off,No Bundles Avaliable,Free shipping for orders over $20,$0.00 - $1.00,4,No Brand,5,1,1,4,liweike.sg,2551,457,98%,within hours,35 months ago,2350
/Flip-man-slippers-summer-seaside-European-and-American-beach-graffiti-anti-ski-i.111640885.1927037167,Flip man slippers summer seaside European and American beach graffiti anti-ski,$6.00 - $7.00,No Discount,No Discount,No Bundles Avaliable,No Free Shipping,$1.00 ,0,No brand,No Ratings Yet,0,0,0,supermallshow.sg,370,3851,53%,within hours,9 months ago,112
/Home-Slipper-Unisex-Combo-Lady-Boy-Girl-Men-Bedroom-DownStair-SG-Seller-i.12405201.1883617419, PreferredHome Slipper Unisex Combo Lady Boy Girl Men Bedroom DownStair SG Seller,$7.50 ,No Discount,No Discount,No Bundles Avaliable,Free shipping,$0.00 - $3.00,1,No Brand,No Ratings Yet,0,0,3,lemonyong,1647,124,100%,within hours,34 months ago,1677
/Summer-Slippers-Men-Women's-Casual-Slipper-Shoes-Mules-i.116728707.1872330943,Summer Slippers Men Women's Casual Slipper Shoes Mules,$6.34 ,$7.46 ,15% off,No Bundles Avaliable,Free shipping for orders over $20,$0.00 - $1.00,0,No brand,No Ratings Yet,0,0,0,walker1688.sg,8,622,75%,within hours,9 months ago,1721
/Men-Women-Couple-Non-slip-Simple-Design-Slippers-i.105385560.1828772542,Men Women Couple Non-slip Simple Design Slippers,$15.00 ,$30.00 ,50% off,No Bundles Avaliable,Free shipping,$0.00 ,0,No brand,No Ratings Yet,0,0,0,snowfashionshop88_2,17,1017,82%,within hours,10 months ago,6
/Men-Women-Couple-Non-slip-Bathroom-Soft-Slippers-i.105385560.1828772528,Men Women Couple Non-slip Bathroom Soft Slippers,$15.50 ,$31.00 ,50% off,No Bundles Avaliable,Free shipping,$0.00 ,0,No brand,No Ratings Yet,0,0,0,snowfashionshop88_2,17,1017,82%,within hours,10 months ago,6
/Boken-Birkenstock-two-button-Frosted-grey-leather-Men-and-women-slippers-i.68906609.1824135459,Boken Birkenstock two-button Frosted grey leather Men and women  slippers,$58.00 ,No Discount,No Discount,No Bundles Avaliable,No Free Shipping,$0.00 ,1,No brand,No Ratings Yet,0,0,2,wzftriple.sg,1,69,57%,within hours,16 months ago,157
/Boken-Birkenstock-two-button-Light-brown-velvet-Men-and-women-slippers-i.68906609.1824135455,Boken Birkenstock two-button Light brown velvet Men and women slippers,$58.00 ,No Discount,No Discount,No Bundles Avaliable,No Free Shipping,$0.00 ,0,No brand,No Ratings Yet,0,0,2,wzftriple.sg,1,69,57%,within hours,16 months ago,157
/Boken-Birkenstock-two-button-Dark-brown-leather-Men-and-women-slippers-i.68906609.1824135454,Boken Birkenstock two-button Dark brown leather Men and women  slippers,$58.00 ,No Discount,No Discount,No Bundles Avaliable,No Free Shipping,$0.00 ,0,No brand,No Ratings Yet,0,0,0,wzftriple.sg,1,69,57%,within hours,16 months ago,157
/Cashmere-house-slippers-winter-cotton-slippers-non-slip-men-slippers-waterproof-i.18584105.1750574498, PreferredCashmere house slippers winter cotton slippers non-slip men slippers waterproof,$12.90 ,No Discount,No Discount,No Bundles Avaliable,Free shipping for orders over $20,$0.00 - $1.00,2,No brand,No Ratings Yet,0,0,2,happyshopee.sg,1683,1079,92%,within hours,30 months ago,1159
/Women-Men-Kids-Household-Woolen-Slippers-Plush-Slippers-i.78658108.1667781974, PreferredWomen Men Kids Household Woolen Slippers Plush Slippers,$8.11 - $11.13,$10.53 - $14.45,23% off,No Bundles Avaliable,Free shipping for orders over $20,$0.00 - $1.00,0,No Brand,No Ratings Yet,0,0,0,loveourhome.sg,331,631,73%,within hours,14 months ago,235
/Hot-Sale-Women-Men-Household-Woolen-Slippers-Plush-Slippers-i.78658108.1667777853, PreferredHot Sale Women Men Household Woolen Slippers Plush Slippers,$12.93 - $13.47,$16.79 - $17.49,23% off,No Bundles Avaliable,Free shipping for orders over $20,$0.00 - $1.00,0,No Brand,No Ratings Yet,0,0,0,loveourhome.sg,331,631,73%,within hours,14 months ago,235
/men-Slippers-sandals-women-white-black(grey-logo)36-40-i.22576164.1588201217,men Slippers sandals women white+black(grey logo)36-40,$8.10 ,$13.50 ,40% off,No Bundles Avaliable,Free shipping for orders over $20,$0.00 - $1.00,0,No Brand,No Ratings Yet,0,0,0,ms.sg,1015,106,56%,within days,28 months ago,1231
/BY-Best-Price-Men-Women-Soft-Winter-Non-slip-Cotton-Slippers-Anti-slip-Shoesmint-i.86825706.1508483376,BY Best Price Men Women Soft Winter Non-slip Cotton Slippers Anti-slip Shoesmint,$7.75 ,$8.61 ,10% off,No Bundles Avaliable,Free shipping for orders over $20,$0.00 - $1.00,0,OEM,No Ratings Yet,0,0,0,baiyang.sg,65,483,82%,within hours,13 months ago,207
/YANXUAN-Denim-Men-Women-Home-Slippers-i.64525380.1484459085,YANXUAN - Denim Men/Women Home Slippers,$14.69 ,No Discount,No Discount,No Bundles Avaliable,No Free Shipping,$1.00 ,0,Netease Yanxuan,No Ratings Yet,0,0,1,yanxuan.sg,627,677,83%,within hours,17 months ago,1264
/Best-Price-Men-Soft-Winter-Non-slip-Women-Cotton-Slippers-Anti-slip-Shoesmint-i.64375867.1469464980,Best Price Men Soft Winter Non-slip Women Cotton Slippers Anti-slip Shoesmint,$2.40 ,No Discount,No Discount,No Bundles Avaliable,Free shipping for orders over $20,$0.00 - $1.00,0,No brand,No Ratings Yet,0,0,0,fashionyounglady.sg,1527,2751,72%,within days,17 months ago,275
/Men-Women-Ready-Stock-Euro-Design-Men-Casual-Summer-Slipper-i.32811867.1434524730,Men&Women Ready Stock - Euro Design Men Casual Summer Slipper,$14.50 ,No Discount,No Discount,No Bundles Avaliable,Free shipping for orders over $20,$0.00 ,0,No brand,No Ratings Yet,0,0,0,yiqilai.sg,74,469,84%,within hours,25 months ago,36
/Men-fashion-beach-shoes-slipper-shoes-39-44-i.76621355.1387151741,Men fashion beach shoes slipper shoes 39-44,$20.00 ,No Discount,No Discount,Any 2 enjoy $3.00 off,Free shipping for orders over $20,$0.00 ,1,No brand,5,0,1,6,dimmoshop.sg,277,437,91%,within hours,15 months ago,553
/Men-slipper-shoes-boys-beach-shoes-39-44-i.76621355.1387151709,Men slipper shoes boys beach shoes  39-44,$20.00 ,No Discount,No Discount,No Bundles Avaliable,Free shipping for orders over $20,$0.00 ,0,No brand,No Ratings Yet,0,0,1,dimmoshop.sg,277,437,91%,within hours,15 months ago,553
/Fashion-Design-Leather-Lazy-Men-Mules-Half-Slipper-Casual-Summer-Shoes-i.48824979.1342224489, PreferredFashion Design Leather Lazy Men Mules Half Slipper Casual Summer Shoes,$19.11 ,$39.00 ,51% off,No Bundles Avaliable,Free shipping for orders over $20,$0.00 - $1.00,1,No brand,No Ratings Yet,0,0,3,orange.sg,204,600,97%,within hours,21 months ago,521
/Men-Non-slip-Couple-Shower-Thick-bottomed-Slippers-i.10615277.1260515038,Men Non-slip Couple Shower Thick-bottomed Slippers,$22.00 ,$44.00 ,50% off,No Bundles Avaliable,Free shipping,$0.00 ,2,No brand,No Ratings Yet,0,0,4,snowfashionshop88,346,3217,91%,within hours,35 months ago,157
/Unisex-Men-Women-Casual-Quick-Drying-Breathable-Slippers-House-Office-Shoes-i.74432940.1245387408,Unisex Men Women Casual Quick Drying Breathable Slippers House Office Shoes,$6.78 ,No Discount,No Discount,No Bundles Avaliable,Free shipping for orders over $20,$0.00 - $1.00,1,No brand,No Ratings Yet,0,0,1,651146166.sg,22,378,10%,within hours,15 months ago,0
/Men-Non-slip-Couple-Shower-Thick-bottomed-Slippers-i.10615277.1243023586,Men Non-slip Couple Shower Thick-bottomed Slippers,$19.50 ,$39.00 ,50% off,No Bundles Avaliable,Free shipping,$0.00 ,0,No brand,No Ratings Yet,0,0,2,snowfashionshop88,346,3217,91%,within hours,35 months ago,157
/Summer-Slippers-Men-Women's-Casual-Slipper-Shoes-Mules-i.48824979.1168522459, PreferredSummer Slippers Men Women's Casual Slipper Shoes Mules,$7.16 ,$14.62 ,51% off,No Bundles Avaliable,Free shipping for orders over $20,$0.00 - $1.00,1,No brand,5,1,1,2,orange.sg,204,600,97%,within hours,21 months ago,521
/Outdoor-Summer-Shoes-Men-Woman-Beach-Sandals-Women-Men-Slippers-Plus-Size-36-45-i.48824979.1168457052, PreferredOutdoor Summer Shoes Men Woman Beach Sandals Women Men Slippers Plus Size 36- 45,$8.40 ,$16.80 ,50% off,No Bundles Avaliable,Free shipping for orders over $20,$0.00 - $1.00,4,No Brand,5,0,0,8,orange.sg,204,600,97%,within hours,21 months ago,521
/Unisex-Women-Men-Summer-Slippers-Soft-Sole-Open-Toe-Shower-Shoes-i.34246897.1149075369, PreferredUnisex Women Men Summer Slippers Soft Sole Open Toe Shower Shoes,$8.84 ,$8.93 ,1% off,No Bundles Avaliable,Free shipping for orders over $20,$0.00 - $1.00,0,No Brand,No Ratings Yet,0,0,1,kkbgood.sg,513,1902,96%,within days,24 months ago,578
/Men-Women-Winter-Plush-Sheep-Slippers-Horse-Animal-Slippers-Ladies-Shoes-Indoor-i.9782095.984173182, PreferredMen Women Winter Plush Sheep Slippers Horse Animal Slippers Ladies Shoes Indoor,$8.24 - $8.74,$8.24 - $12.49,30% off,No Bundles Avaliable,Free shipping for orders over $20,$0.00 - $1.00,3,No Brand,4,0,1,3,elenxs.sg,4946,3159,79%,within hours,3 years ago,1524
/1-Pair-Soft-Men-Plastic-Slipper-with-Non-slip-Thicken-Sole-i.50235900.851513629,1 Pair Soft Men Plastic Slipper with Non-slip Thicken Sole,$6.27 ,$8.18 ,23% off,No Bundles Avaliable,Free shipping for orders over $20,$0.00 - $1.00,0,No brand,No Ratings Yet,0,0,0,bolaile9999.sg,91,1313,66%,within hours,21 months ago,6
/Men-Women-Slippers-Warm-Breathable-Fur-Shoes-i.5859784.645382282, PreferredMen & Women Slippers Warm Breathable Fur Shoes,$8.38 - $8.44,No Discount,No Discount,No Bundles Avaliable,Free shipping for orders over $20,$0.00 - $1.00,0,No brand,No Ratings Yet,0,0,0,formydarling.sg,11890,4878,91%,within hours,3 years ago,2430
/men-summer-Household-Non-slip-baotou-slippers-i.20150784.223772503,men summer Household Non-slip baotou slippers,$10.90 ,No Discount,No Discount,No Bundles Avaliable,Free shipping for orders over $20,$0.00 - $1.00,2,No brand,No Ratings Yet,0,0,0,fancyocean.sg,59,501,0%,within hours,29 months ago,18
/Striped-Cloth-Bottom-Couples-Women-Men-Warm-Slippers-Non-i.8715449.197311108,Striped Cloth Bottom Couples Women Men Warm Slippers Non,$1.90 - $2.50,No Discount,No Discount,No Bundles Avaliable,Free shipping,$0.00 ,23,No brand,4.9,0,6,18,timemaster.sg,11885,4985,94%,within hours,3 years ago,2447
/10-Pairs-Hotel-Travel-Spa-Disposable-Slippers-for-Men-and-Women-i.13495361.2616774702,10 Pairs Hotel Travel Spa Disposable Slippers for Men and Women,$6.60 ,$8.80 ,25% off,No Bundles Avaliable,Free shipping for orders over $20,$0.00 - $1.00,0,No Brand,No Ratings Yet,0,0,0,delaman.sg,1225,1883,90%,within hours,33 months ago,1311
/xggg-summer-cool-slippers-for-men-and-women-i.162545988.2546185838,xggg summer cool slippers for men and women,$9.08 ,No Discount,No Discount,No Bundles Avaliable,Free shipping for orders over $20,$0.00 - $1.00,0,No Brand,No Ratings Yet,0,0,0,iq3q.sip.sg,0,230,57%,within hours,2 months ago,1
/Buy-a-slippers-for-women's-summer-2019-new-indoor-home-with-couples-bathroom-non-slip-bath-cool-drag-man-i.119590155.2425709698,Buy a slippers for women's summer 2019 new indoor home with couples bathroom non-slip bath cool drag man,$11.00 ,No Discount,No Discount,No Bundles Avaliable,Free shipping for orders over $20,$0.00 - $1.00,0,No Brand,No Ratings Yet,0,0,0,szruibaodianzi3.sg,29,2910,90%,within hours,8 months ago,26
/Buy-a-slipper-for-women-summer-home-indoor-bathroom-anti-skid-bathing-couple-slippers-men-soft-Bottom-i.119590057.2425697673,Buy a slipper for women summer home indoor bathroom anti-skid bathing couple slippers men soft Bottom,$10.00 ,No Discount,No Discount,No Bundles Avaliable,Free shipping for orders over $20,$0.00 - $1.00,0,No Brand,No Ratings Yet,0,0,0,szruibaodianzi2.sg,30,2121,80%,within hours,8 months ago,29
/Cotton-slippers-women's-winter-bag-with-indoor-cute-home-couple-thick-soled-plush-moon-son-post-partum-shoes-men-i.119590057.2425691891,Cotton slippers women's winter bag with indoor cute home couple thick-soled plush moon son post-partum shoes men,$10.00 ,No Discount,No Discount,No Bundles Avaliable,Free shipping for orders over $20,$0.00 - $1.00,0,No Brand,No Ratings Yet,0,0,0,szruibaodianzi2.sg,30,2121,80%,within hours,8 months ago,29
/Buy-a-slippers-for-women's-summer-2019-new-home-non-slip-indoor-and-outdoor-bathroom-bath-cute-cool-drag-man-i.119590057.2425515046,Buy a slippers for women's summer 2019 new home non-slip indoor and outdoor bathroom bath cute cool drag man,$11.00 ,No Discount,No Discount,No Bundles Avaliable,Free shipping for orders over $20,$0.00 - $1.00,0,No Brand,No Ratings Yet,0,0,0,szruibaodianzi2.sg,30,2121,80%,within hours,8 months ago,29
/Buy-a-couple-of-moon-cotton-slippers-female-winter-bag-and-home-with-indoor-anti-skid-hair-drag-man-i.119590155.2425385726,Buy a couple of moon cotton slippers female winter bag and home with indoor anti-skid hair drag man,$16.00 ,No Discount,No Discount,No Bundles Avaliable,Free shipping for orders over $20,$0.00 - $1.00,0,No Brand,No Ratings Yet,0,0,0,szruibaodianzi3.sg,29,2910,90%,within hours,8 months ago,26
/2019-New-Slippers-Women's-summer-home-with-indoor-anti-skid-couple-bathroom-shower-leaky-man-i.119590057.2425227040,2019 New Slippers Women's summer home with indoor anti-skid couple bathroom shower leaky man,$6.00 - $7.00,No Discount,No Discount,No Bundles Avaliable,Free shipping for orders over $20,$0.00 - $1.00,0,No Brand,No Ratings Yet,0,0,0,szruibaodianzi2.sg,30,2121,80%,within hours,8 months ago,29
/Outside-in-the-summer-of-2019-new-slippers-women-wear-fashionable-woman-with-flat-sandals-beach-antiskid-men-and-lov-i.119337371.2291469637,Outside in the summer of 2019 new slippers women wear fashionable woman with flat sandals beach antiskid men and lov,$15.00 ,No Discount,No Discount,No Bundles Avaliable,Free shipping for orders over $20,$0.00 - $1.00,0,No Brand,No Ratings Yet,0,0,0,qingdaodajian2.sg,16,3081,98%,within hours,8 months ago,21
/Simple-flat-rubber-slipper-slippers-for-men-and-women-couple-i.76750745.2215413549,Simple flat rubber slipper slippers for men and women couple,$17.50 ,No Discount,No Discount,No Bundles Avaliable,Free shipping for orders over $20,$0.00 - $1.00,0,No Brand,No Ratings Yet,0,0,0,beixiang.sg,3,2963,57%,within hours,15 months ago,3
/Anti-static-slippers-clean-dust-free-protective-slippers-men-and-women-i.130100254.2188872477,Anti-static slippers clean dust-free protective slippers men and women,$5.73 - $7.45,$15.50 - $20.15,63% off,No Bundles Avaliable,Free shipping for orders over $20,$0.00 - $1.00,0,No brand,No Ratings Yet,0,0,0,hottoppe.sg,275,4554,85%,within hours,7 months ago,103
/Anti-static-slippers-clean-dust-free-protective-slippers-men-and-women-i.130100254.2188872465,Anti-static slippers clean dust-free protective slippers men and women,$5.86 - $7.34,$15.85 - $19.85,63% off,No Bundles Avaliable,Free shipping for orders over $20,$0.00 - $1.00,0,No brand,No Ratings Yet,0,0,0,hottoppe.sg,275,4554,85%,within hours,7 months ago,103
/anti-static-slippers-clean-dust-free-protective-slippers-men-and-women-clean-working-shoes-soft-bottom-black-diarola-i.130100056.2059382471,anti-static slippers clean dust-free protective slippers men and women clean working shoes soft bottom black diarola,$9.80 - $12.52,No Discount,No Discount,No Bundles Avaliable,Free shipping for orders over $20,$0.00 - $1.00,0,No brand,No Ratings Yet,0,0,0,diarola.sg,149,4859,29%,within hours,7 months ago,63
/Cork-slippers-beach-shoes-for-men-and-women-outdoor-seaside-word-drag-outside-we-i.76667628.1563892187,Cork slippers beach shoes for men and women outdoor seaside word drag outside we,$24.20 ,No Discount,No Discount,No Bundles Avaliable,Free shipping for orders over $20,$0.00 ,0,No Brand,No Ratings Yet,0,0,1,jianhua66.sg,61,4938,83%,within hours,15 months ago,270
/We-Bare-Bears-Panda-Grizzly-Winter-Half-Pack-Bedroom-Slippers-Women-Man-Shoes-i.67975263.2065793963, PreferredWe Bare Bears Panda Grizzly Winter Half Pack Bedroom Slippers Women Man Shoes,$10.90 ,No Discount,No Discount,No Bundles Avaliable,Free shipping for orders over $20,$0.00 - $1.00,48,No Brand,5,9,12,65,bigtree.sg,2777,331,99%,within hours,16 months ago,309
/TTLIFE10-Plastic-men-sandals-cool-slippers-non-slip-breathable-i.14925755.1881446288,TTLIFE10 Plastic men sandals cool slippers non-slip breathable,$8.00 ,No Discount,No Discount,No Bundles Avaliable,No Free Shipping,$0.00 - $1.00,7,No Brand,4,0,0,30,ttlife10.sg,292,48,78%,within hours,32 months ago,242
/Sandals-men's-little-monster-summer-Korean-fashion-large-size-slip-thick-bottom-home-wearing-slippers-men-i.162317015.2472058431,Sandals men's little monster summer Korean fashion large size slip thick bottom home wearing slippers men,$8.91 ,$13.30 ,33% off,No Bundles Avaliable,Free shipping for orders over $20,$0.00 - $1.00,4,No Brand,5,0,0,3,hhalzy.sg,3,131,100%,within hours,2 months ago,120
/Uni-Women-Men-Flannel-Open-Toe-Hotel-Home-Indoor-Fleece-Winter-Slippers-Hot-i.91087572.1842292789, PreferredUni  Women Men Flannel Open Toe Hotel Home Indoor Fleece Winter Slippers Hot,$2.91 ,$12.22 ,76% off,No Bundles Avaliable,Free shipping for orders over $20,$0.00 - $1.00,46,No Brand,4.5,3,4,32,datings.sg,659,7564,81%,within hours,12 months ago,41
/men-Fashion-Solid-Color-Casual-Non-slip-Thick-Bottom-Home-Slippers-i.29238486.2589586047, Preferredmen Fashion Solid Color Casual Non-slip Thick Bottom Home Slippers,$3.99 ,$6.65 ,40% off,No Bundles Avaliable,Free shipping for orders over $20,$0.00 - $1.00,2,No Brand,5,0,0,1,powder.sg,2707,3243,100%,within hours,25 months ago,782
/Original-Birkenstock-Men-Women-Slipper-Boston-Leather-Slipper-Casual-Cork-Shoes-Black-i.99608764.2583562694,Original Birkenstock Men Women Slipper Boston Leather Slipper Casual Cork Shoes Black,$66.50 ,$95.00 ,30% off,Any 2 at $115.00,No Free Shipping,$1.00 ,2,Birkenstock,No Ratings Yet,0,0,3,namanmaoyi.sg,57,823,97%,within hours,11 months ago,974
/Authentic-German-BirkenstockMilano-men-and-women-leather-cork-sandals-large-size-slippers-i.163415354.2465921551,Authentic German BirkenstockMilano men and women leather cork sandals large size slippers,$39.37 ,$127.00 ,69% off,No Bundles Avaliable,Free shipping for orders over $20,$0.00 ,3,Birkenstock,5,0,1,99,huant.sg,11,21,100%,within hours,60 days ago,19
/Birkenstock-Cork-Slipper-Men-Women-Double-Buckle-Suede-Beach-Shoes-i.99608764.2380761766,Birkenstock Cork Slipper Men Women Double Buckle Suede Beach Shoes,$38.50 ,$55.00 ,30% off,Any 2 at $75.00,No Free Shipping,$1.00 ,3,Birkenstock,5,0,0,2,namanmaoyi.sg,57,823,97%,within hours,11 months ago,974
/Original-Birkenstock-Cork-Slipper-Men-Women-Leather-Casual-Beach-Shoes-i.99608764.2380761721,Original Birkenstock Cork Slipper Men Women Leather Casual Beach Shoes,$38.50 ,$55.00 ,30% off,Any 2 at $75.00,No Free Shipping,$1.00 ,3,Birkenstock,5,0,0,3,namanmaoyi.sg,57,823,97%,within hours,11 months ago,974
/Summer-Men-shoes-Breathable-Waterproof-Non-slip-Beach-shoes-Slippers-Korean-version-Sandals-i.151697239.2379516350,Summer Men shoes Breathable Waterproof Non-slip Beach shoes Slippers Korean version Sandals,$11.29 ,$22.59 ,50% off,No Bundles Avaliable,Free shipping for orders over $20,$0.00 - $1.00,2,No Brand,5,2,2,5,nbshoes.sg,117,103,90%,within hours,4 months ago,56
/-Original-New-Slippers-Men-Women-Medusa-Embossed-Upper-Classic-Style-Sandals-i.140783245.2207657299,[Original] New Slippers Men Women Medusa Embossed Upper Classic Style Sandals,$36.00 ,No Discount,No Discount,No Bundles Avaliable,Free shipping for orders over $20,$0.00 ,2,No Brand,No Ratings Yet,0,0,12,huali.sg,15,286,87%,within hours,5 months ago,25
/OriginalBirkenstock-FLORIDA-Florida-Three-Button-Men-and-women-Slippers-i.63692334.1426469751,OriginalBirkenstock FLORIDA Florida Three Button Men and women Slippers,$40.64 ,$41.90 ,3% off,Any 2 enjoy 5% off,Free shipping for orders over $20,$0.00 ,19,Birkenstock,5,1,3,28,yfcompany.sg,302,222,84%,within hours,17 months ago,819
/Men's-sandalsSlippers-men-and-Summer-men's-Sandals-Korean-version-2019-male-i.147144268.2683852189,Men's sandalsSlippers men and Summer men's Sandals Korean version 2019 male,$20.00 - $23.00,No Discount,No Discount,No Bundles Avaliable,Free shipping for orders over $20,$0.00 ,1,No Brand,No Ratings Yet,0,0,1,dd3s1,12,1477,77%,within hours,4 months ago,5
/Big-Logo-Black-and-White-Men-Mens-Men's-Men-S-Male-Lelaki-Slippers-Slides-Selipar-Sandals-Beach-Indoor-Sport-i.169903775.2673329965,Big Logo Black and White Men Mens Men's Men S Male Lelaki Slippers Slides Selipar Sandals Beach Indoor Sport,$37.50 ,$75.00 ,50% off,No Bundles Avaliable,Free shipping for orders over $20,$0.00 ,1,No Brand,5,0,0,0,nikeshoes.sg,16,264,100%,within hours,34 days ago,43
/Bape-x-Suicoke-ABC-KawKisee-Ape-18ss-Women-Men-Trendy-Summer-Slippers-Sandals-i.170053176.2658610265,Bape x Suicoke ABC KawKisee Ape 18ss Women Men Trendy Summer Slippers Sandals,$52.00 ,No Discount,No Discount,No Bundles Avaliable,Free shipping for orders over $20,$0.00 ,1,No Brand,5,0,0,1,lixsa.sg,2,797,100%,within hours,33 days ago,4
/Men-Women-Sanitary-Closed-Toe-Travel-Hotel-Use-Non-Slip-Spa-Fluffy-Home-Disposable-Slipper-Guest-Bathroom-10-Pairs-i.132655953.2598184161, PreferredMen Women Sanitary Closed Toe Travel Hotel Use Non Slip Spa Fluffy Home Disposable Slipper Guest Bathroom 10 Pairs,$4.98 ,$9.42 ,47% off,No Bundles Avaliable,Free shipping for orders over $20,$0.00 - $1.00,1,No Brand,4,0,0,0,haitang.sg,477,7132,86%,within hours,6 months ago,37
/Kaws-Couple-Slippers-Men-Wonmen-Casual-Street-House-Slippers-i.90172857.2512899599,Kaws Couple Slippers Men Wonmen Casual Street House Slippers,$7.80 - $10.20,$26.70 ,71% off,No Bundles Avaliable,Free shipping for orders over $20,$0.00 - $1.00,1,No Brand,5,0,1,7,syk.shitou.sg,525,544,91%,within hours,12 months ago,354
/Kaws-Men-Women-Couple-Sandals-Slippers-Casual-House-Slippers-i.90172857.2511659300,Kaws Men Women Couple Sandals Slippers Casual House Slippers,$7.80 - $10.20,$26.70 ,71% off,No Bundles Avaliable,Free shipping for orders over $20,$0.00 - $1.00,3,No Brand,4.5,0,0,3,syk.shitou.sg,525,544,91%,within hours,12 months ago,354
/Authentic-German-Birkenstock-shoes-Mayari-Boken-men-and-women-softwood-toe-sandals-and-slippers-i.163415354.2499527722,Authentic German Birkenstock shoes Mayari Boken men and women softwood toe sandals and slippers,$39.37 ,$127.00 ,69% off,No Bundles Avaliable,Free shipping for orders over $20,$0.00 ,3,Birkenstock,5,0,0,86,huant.sg,11,21,100%,within hours,60 days ago,19
/Authentic-German-Birkenstock-Mayari-Boken-men-and-women-softwood-toe-sandals-and-slippers-female-summer-i.163415354.2488729552,Authentic German Birkenstock Mayari Boken men and women softwood toe sandals and slippers female summer,$39.37 ,$127.00 ,69% off,No Bundles Avaliable,Free shipping for orders over $20,$0.00 ,1,Birkenstock,5,0,1,87,huant.sg,11,21,100%,within hours,60 days ago,19
/Men-Casual-Slippers-Plain-Peep-Toe-Flat-Beach-Pool-Summer-Home-Casual-i.19216692.2464136676, PreferredMen Casual Slippers Plain Peep Toe Flat Beach Pool Summer Home Casual,$14.96 ,$23.02 ,35% off,No Bundles Avaliable,Free shipping for orders over $20,$0.00 - $1.00,2,No Brand,5,0,1,2,coobuy.sg,12148,4106,99%,within hours,30 months ago,3347
/Anti-Slip-EVA-Nursing-Clogs-Chef-Kitchen-Clogs-Slipper-Work-Shoes-Women-Men-i.140625780.2461823353,Anti Slip EVA Nursing Clogs Chef Kitchen Clogs Slipper Work Shoes Women Men,$11.12 - $27.61,$21.39 - $53.10,48% off,Any 2 enjoy 5% off,Free shipping for orders over $20,$0.00 - $1.00,1,No Brand,5,1,1,1,cuticate.sg,15,1720,75%,within hours,5 months ago,89
/-Original-Sandals-Men-Slippers-Women-N-I-K-E-WMNS-BENASSI-SWOOSH-Summer-Sports-i.95967043.2393750546,[Original] Sandals Men Slippers Women N-I-K-E WMNS BENASSI SWOOSH Summer Sports,$26.00 ,No Discount,No Discount,No Bundles Avaliable,No Free Shipping,$1.00 ,3,Nike,5,0,2,6,yingpa.sg,21,49,98%,within hours,11 months ago,1033
/Birkenstock-Cork-Slipper-Double-Buckle-Men-Women-Leather-Slipper-cream-coloured-i.99608764.2380761755,Birkenstock Cork Slipper Double Buckle Men Women Leather Slipper cream-coloured,$38.50 ,$55.00 ,30% off,Any 2 at $75.00,No Free Shipping,$1.00 ,1,Birkenstock,5,0,0,1,namanmaoyi.sg,57,823,97%,within hours,11 months ago,974
/Original-Birkenstock-Men-Women-Cork-Slipper-Suede-Black-Slipper-i.99608764.2380761736,Original Birkenstock Men Women Cork Slipper Suede Black Slipper,$38.50 ,$55.00 ,30% off,Any 2 at $75.00,No Free Shipping,$1.00 ,1,Birkenstock,5,1,1,4,namanmaoyi.sg,57,823,97%,within hours,11 months ago,974
/Male-outside-in-the-summer-of-2019-new-wear-slippers-man-word-procrastinates-individuality-outdoor-non-slip-bottom-sa-i.130107642.2311732212,Male outside in the summer of 2019 new wear slippers man word procrastinates individuality outdoor non-slip bottom sa,$16.33 ,$23.00 ,29% off,No Bundles Avaliable,Free shipping for orders over $20,$0.00 - $1.00,1,No Brand,5,0,0,0,sistery.sg,9,768,37%,within hours,6 months ago,5
/2018-New-Summer-Leather-men's-sandals-big-size-male-Slippers-Man-i.119595148.2276473707,2018 New Summer Leather men's sandals big-size male Slippers Man,$18.00 ,No Discount,No Discount,No Bundles Avaliable,Free shipping for orders over $20,$0.00 - $1.00,3,No Brand,5,0,0,1,szmengte2.sg,77,2213,67%,within hours,8 months ago,48
/Fashion-Summer-Men-Slippers-Boy-Outdoor-Beach-Sandals-Flat-Slippers-Bedroom-Shoes-i.11271939.2154405904,Fashion Summer Men Slippers Boy Outdoor Beach Sandals Flat Slippers Bedroom Shoes,$11.00 ,$15.00 ,27% off,No Bundles Avaliable,Free shipping for orders over $20,$0.00 - $1.00,3,No Brand,5,1,1,9,liweike.sg,2551,457,98%,within hours,35 months ago,2350
/READY-STOCKOriginal-Birkenstock-Men-and-women-Sandals-slippers-i.122243341.2145995077,READY STOCKOriginal Birkenstock Men and women  Sandals slippers,$39.06 ,$62.00 ,37% off,No Bundles Avaliable,Free shipping for orders over $20,$0.00 ,2,Birkenstock,5,1,1,7,allbest.sg,100,223,86%,within hours,8 months ago,98
