/Summer-soft-bottom-sandals-and-slippers-Household-plastic-men-and-women-home-sho-i.102385714.2227351402,Summer soft bottom sandals and slippers Household plastic men and women home sho,$7.80 - $8.50,No Discount,No Discount,No Bundles Avaliable,Free shipping for orders over $20,$0.00 - $1.00,0,No Brand,No Ratings Yet,0,0,0,yeshu003.sg,19,2560,69%,within hours,10 months ago,8
/Spring-and-summer-home-linen-slippers-Striped-men-and-women-couples-indoor-anti--i.102385714.2227024273,Spring and summer home linen slippers Striped men and women couples indoor anti-,$7.50 - $9.90,No Discount,No Discount,No Bundles Avaliable,Free shipping for orders over $20,$0.00 - $1.00,0,No Brand,No Ratings Yet,0,0,0,yeshu003.sg,19,2560,69%,within hours,10 months ago,8
/Wild-Korean-Bathroom-Indoor-Slippers-Men-Women-a656-i.32351807.2219041823, PreferredWild Korean Bathroom Indoor Slippers Men / Women a656,$6.53 ,No Discount,No Discount,No Bundles Avaliable,Free shipping,$0.00 ,0,Taiwan Collection,No Ratings Yet,0,0,1,taiwancollection.sg,29698,142593,93%,within hours,25 months ago,9410
/men-and-women-couple-slippers-home-bamboo-rattan-cool-slippers-i.145021377.2218244058,men and women couple slippers home bamboo rattan cool slippers,$8.64 ,$14.25 ,39% off,No Bundles Avaliable,Free shipping for orders over $20,$0.00 - $1.00,0,No Brand,No Ratings Yet,0,0,0,q2bv.sip.sg,11,864,72%,within hours,4 months ago,52
/VARITY*1-Pair-Bath-Slip-On-Women-Men-Summer-Shower-Bathroom-Slippers-i.26432438.2205847992,VARITY*1 Pair Bath Slip On Women Men Summer Shower Bathroom Slippers,$3.08 - $3.48,$6.70 - $7.57,54% off,No Bundles Avaliable,Free shipping for orders over $20,$0.00 - $1.00,0,No Brand,No Ratings Yet,0,0,0,varitystore.sg,3487,2613,95%,within hours,27 months ago,1391
/VARITY*1-Pair-Bath-Slip-On-Women-Men-Summer-Shower-Bathroom-Slippers-i.26432438.2205847992,VARITY*1 Pair Bath Slip On Women Men Summer Shower Bathroom Slippers,$3.08 - $3.48,$6.70 - $7.57,54% off,No Bundles Avaliable,Free shipping for orders over $20,$0.00 - $1.00,0,No Brand,No Ratings Yet,0,0,0,varitystore.sg,3487,2613,95%,within hours,27 months ago,1391
/VARITY*1-Pair-Bath-Slip-On-Women-Men-Summer-Shower-Bathroom-Slippers-i.26432438.2205847992,VARITY*1 Pair Bath Slip On Women Men Summer Shower Bathroom Slippers,$3.08 - $3.48,$6.70 - $7.57,54% off,No Bundles Avaliable,Free shipping for orders over $20,$0.00 - $1.00,0,No Brand,No Ratings Yet,0,0,0,varitystore.sg,3487,2613,95%,within hours,27 months ago,1391
/VARITY*1-Pair-Bath-Slip-On-Women-Men-Summer-Shower-Bathroom-Slippers-i.26432438.2205847992,VARITY*1 Pair Bath Slip On Women Men Summer Shower Bathroom Slippers,$3.08 - $3.48,$6.70 - $7.57,54% off,No Bundles Avaliable,Free shipping for orders over $20,$0.00 - $1.00,0,No Brand,No Ratings Yet,0,0,0,varitystore.sg,3487,2613,95%,within hours,27 months ago,1391
/VARITY*1-Pair-Bath-Slip-On-Women-Men-Summer-Shower-Bathroom-Slippers-i.26432438.2205847992,VARITY*1 Pair Bath Slip On Women Men Summer Shower Bathroom Slippers,$3.08 - $3.48,$6.70 - $7.57,54% off,No Bundles Avaliable,Free shipping for orders over $20,$0.00 - $1.00,0,No Brand,No Ratings Yet,0,0,0,varitystore.sg,3487,2613,95%,within hours,27 months ago,1391
/VARITY*1-Pair-Bath-Slip-On-Women-Men-Summer-Shower-Bathroom-Slippers-i.26432438.2205847992,VARITY*1 Pair Bath Slip On Women Men Summer Shower Bathroom Slippers,$3.08 - $3.48,$6.70 - $7.57,54% off,No Bundles Avaliable,Free shipping for orders over $20,$0.00 - $1.00,0,No Brand,No Ratings Yet,0,0,0,varitystore.sg,3487,2613,95%,within hours,27 months ago,1391
/Bathroom-Slippers-Home-bath-indoor-living-room-non-slip-leaky-men-and-women-i.119595814.2167173175,Bathroom Slippers Home bath indoor living room non-slip leaky men and women,$9.00 ,No Discount,No Discount,No Bundles Avaliable,Free shipping for orders over $20,$0.00 - $1.00,0,No Brand,No Ratings Yet,0,0,0,shenglingmaoyi.sg,37,2742,68%,within hours,8 months ago,84
/Home-Slippers-men's-summer-indoor-bathroom-anti-skid-men-and-women-thick-soft-i.119595814.2167172047,Home Slippers men's summer indoor bathroom anti-skid men and women thick soft,$8.00 ,No Discount,No Discount,No Bundles Avaliable,Free shipping for orders over $20,$0.00 - $1.00,0,No Brand,No Ratings Yet,0,0,0,shenglingmaoyi.sg,37,2742,68%,within hours,8 months ago,84
/Summer-home-indoor-couple-bathroom-slippers-men-and-women-bathing-anti-skid-ho-i.119595814.2167171912,Summer home indoor couple bathroom slippers men and women bathing anti-skid ho,$6.00 - $7.00,No Discount,No Discount,No Bundles Avaliable,Free shipping for orders over $20,$0.00 - $1.00,0,No Brand,No Ratings Yet,0,0,1,shenglingmaoyi.sg,37,2742,68%,within hours,8 months ago,84
/Home-Slippers-New-men-and-women-outside-summer-wear-couple-fashion-cartoon-bat-i.130106495.2166753520,Home Slippers New men and women outside summer wear couple fashion cartoon bat,$7.00 - $7.70,$10.00 - $11.00,30% off,No Bundles Avaliable,Free shipping for orders over $20,$0.00 - $1.00,0,No Brand,No Ratings Yet,0,0,0,finney.sg,23,1095,81%,within hours,6 months ago,4
/Men-Women's-Soft-Long-Plush-Solid-Foam-Silent-Soles-Winter-Non-slip-Indoor-i.91685020.2162601016,Men Women's Soft Long Plush Solid Foam Silent Soles Winter Non-slip Indoor,$3.10 - $3.80,$10.40 ,70% off,No Bundles Avaliable,Free shipping for orders over $20,$0.00 - $1.00,0,No brand,No Ratings Yet,0,0,1,coolboy.sg,256,3658,80%,within hours,12 months ago,17
/Cloth-Sewing-Thread-Slippers-2019-Summer-Men-and-Women-Couple-TPR-Slippers-i.63703359.2155723687,Cloth Sewing Thread Slippers 2019 Summer Men and Women Couple TPR Slippers,$14.10 ,No Discount,No Discount,No Bundles Avaliable,No Free Shipping,$0.00 ,0,No Brand,No Ratings Yet,0,0,0,lifeenjoy.sg,125,2433,45%,within hours,17 months ago,46
/ISLIKE-Hollow-Breathable-Slippers-Men-Women-Couple-Thickening-EVA-Slippers-i.63703359.2155723597,ISLIKE Hollow Breathable Slippers Men Women Couple Thickening EVA Slippers,$13.70 ,No Discount,No Discount,No Bundles Avaliable,No Free Shipping,$0.00 ,0,No Brand,No Ratings Yet,0,0,0,lifeenjoy.sg,125,2433,45%,within hours,17 months ago,46
/Fashion-Men-Women-Linen-Indoor-Home-Slippers-Home-Garden-Hou-i.102385372.2155065402,Fashion Men Women Linen Indoor Home Slippers Home Garden Hou,$8.18 ,No Discount,No Discount,No Bundles Avaliable,Free shipping for orders over $20,$0.00 - $1.00,0,No Brand,No Ratings Yet,0,0,0,maige002.sg,15,2946,80%,within hours,10 months ago,10
/Men-Women-Vogue-Winter-Warm-Slippers-Indoor-Floor-Shoes-Non-i.102385372.2155035338,Men Women Vogue  Winter Warm Slippers Indoor Floor Shoes Non,$7.55 ,No Discount,No Discount,No Bundles Avaliable,Free shipping for orders over $20,$0.00 - $1.00,0,No Brand,No Ratings Yet,0,0,0,maige002.sg,15,2946,80%,within hours,10 months ago,10
/1pair-Man-Women-Winter-Skid-proof-Plush-Home-Warm-Slippers-i.123828617.2148283810,1pair Man Women Winter Skid-proof Plush Home Warm Slippers,$16.31 ,No Discount,No Discount,No Bundles Avaliable,Free shipping for orders over $20,$0.00 - $1.00,0,No Brand,No Ratings Yet,0,0,1,yuankai777.sg,5,2970,84%,within hours,7 months ago,12
/1pair-Man-Women-Winter-Skid-proof-Plush-Home-Warm-Slippers-Plush-Slippers-i.123828617.2148283148,1pair Man Women Winter Skid-proof Plush Home Warm Slippers Plush Slippers,$16.31 ,No Discount,No Discount,No Bundles Avaliable,Free shipping for orders over $20,$0.00 - $1.00,0,No Brand,No Ratings Yet,0,0,2,yuankai777.sg,5,2970,84%,within hours,7 months ago,12
/Korean-couple-slippers-summer-men-and-women-slip-home-home-bathroom-indoor-and-o-i.76667991.2136952007,Korean couple slippers summer men and women slip home home bathroom indoor and o,$12.92 ,No Discount,No Discount,No Bundles Avaliable,Free shipping for orders over $20,$0.00 - $1.00,0,No Brand,No Ratings Yet,0,0,1,jipinhui.sg,42,2955,99%,within hours,15 months ago,1621
/Summer-new-Korean-version-of-the-little-monster-devil-slippers-men-and-women-fas-i.76667991.2136945174,Summer new Korean version of the little monster devil slippers men and women fas,$13.63 ,No Discount,No Discount,No Bundles Avaliable,Free shipping for orders over $20,$0.00 - $1.00,0,No Brand,No Ratings Yet,0,0,0,jipinhui.sg,42,2955,99%,within hours,15 months ago,1621
/HK-Women-Men-Anti-slip-Linen-Plaid-Home-Indoor-Slippers-Open-Toe-Shoes-i.134391803.2135113951,HK Women Men Anti-slip Linen Plaid Home Indoor Slippers Open Toe Shoes,$7.00 ,No Discount,No Discount,No Bundles Avaliable,Free shipping for orders over $20,$0.00 - $1.00,0,No Brand,No Ratings Yet,0,0,0,5ghk.sg,64,627,96%,within hours,6 months ago,27
/Hong-Kong-students-wear-thick-soled-lace-sandals-and-slippers-men-and-women-summ-i.76667991.2133735692,Hong Kong students wear thick-soled lace sandals and slippers men and women summ,$16.13 ,No Discount,No Discount,No Bundles Avaliable,Free shipping for orders over $20,$0.00 - $1.00,0,No Brand,No Ratings Yet,0,0,0,jipinhui.sg,42,2955,99%,within hours,15 months ago,1621
/Slippers-female-summer-simple-simple-color-home-bath-indoor-and-outdoor-wear-men-i.76667991.2130851259,Slippers female summer simple simple color home bath indoor and outdoor wear men,$14.34 ,No Discount,No Discount,No Bundles Avaliable,Free shipping for orders over $20,$0.00 - $1.00,0,No Brand,No Ratings Yet,0,0,0,jipinhui.sg,42,2955,99%,within hours,15 months ago,1621
/-Hot-sale-home-indoor-soft-bottom-couple-slippers-men-and-women-home-summer-hom-i.119840555.2106491409,[Hot sale] home indoor soft bottom couple slippers men and women home summer hom,$24.80 - $26.90,No Discount,No Discount,No Bundles Avaliable,Free shipping for orders over $20,$0.00 ,0,No Brand,No Ratings Yet,0,0,0,anyang777.sg,12,2843,91%,within hours,8 months ago,1
/Slippers-men-and-women-summer-Korean-version-soft-bottom-non-slip-indoor-bathroo-i.76667525.2103510714,Slippers men and women summer Korean version soft bottom non-slip indoor bathroo,$21.83 ,$22.98 ,5% off,No Bundles Avaliable,Free shipping for orders over $20,$0.00 ,0,No Brand,No Ratings Yet,0,0,0,chunhua.sg,10,2785,44%,within hours,15 months ago,8
/Spring-Linen-Slippers-Female-summer-home-couple-indoor-wood-floor-deodorant-men-i.130106495.2087623340,Spring Linen Slippers Female summer home couple indoor wood floor deodorant men,$7.70 ,$11.00 ,30% off,No Bundles Avaliable,Free shipping for orders over $20,$0.00 - $1.00,0,No Brand,No Ratings Yet,0,0,0,finney.sg,23,1095,81%,within hours,6 months ago,4
/flip-flopSummer-anti-skid-sheepskin-slippers-indoor-home-floor-men-and-women-i.119310898.2071925724,flip flopSummer anti-skid sheepskin slippers indoor home floor men and women ,$15.00 ,No Discount,No Discount,No Bundles Avaliable,Free shipping for orders over $20,$0.00 - $1.00,0,No Brand,No Ratings Yet,0,0,0,gzguli2.sg,25,2317,48%,within hours,8 months ago,5
/flip-flopSlippers-Female-Xia-Home-bathing-man-mute-soft-bottom-couple-indoor-i.119310898.2071886499,flip flopSlippers Female Xia Home bathing man mute soft bottom couple indoor ,$16.00 ,No Discount,No Discount,No Bundles Avaliable,Free shipping for orders over $20,$0.00 - $1.00,0,No Brand,No Ratings Yet,0,0,0,gzguli2.sg,25,2317,48%,within hours,8 months ago,5
/Slippers-female-summer-indoor-men-flat-Bottom-Cool-Drag-Korean-version-sandals-i.130106495.2064278602,Slippers female summer indoor men flat Bottom Cool Drag Korean version sandals,$12.42 - $13.11,$18.00 - $19.00,31% off,No Bundles Avaliable,Free shipping for orders over $20,$0.00 - $1.00,0,No Brand,No Ratings Yet,0,0,0,finney.sg,23,1095,81%,within hours,6 months ago,4
/Summer-New-Slippers-female-sharpin-middle-aged-women's-shoes-old-man-outdoor-we-i.130106495.2064274293,Summer New Slippers female sharpin middle-aged women's shoes old man outdoor we,$12.07 ,$17.00 ,29% off,No Bundles Avaliable,Free shipping for orders over $20,$0.00 - $1.00,0,No Brand,No Ratings Yet,0,0,0,finney.sg,23,1095,81%,within hours,6 months ago,4
/New-Men-Women-Soft-Warm-Indoor-Slippers-Cotton-Sandal-House-Home-Anti-slip-Shoes-diarola-i.130100056.2059384484,New Men Women Soft Warm Indoor Slippers Cotton Sandal House Home Anti-slip Shoes diarola,$5.08 - $6.80,No Discount,No Discount,No Bundles Avaliable,Free shipping for orders over $20,$0.00 - $1.00,0,No brand,No Ratings Yet,0,0,1,diarola.sg,149,4859,29%,within hours,6 months ago,63
/-Women-Men-Linen-Floral-Home-Indoor-Slipper-Open-Toe-Flax-i.135054432.2051746426, Women/Men Linen Floral Home Indoor Slipper Open Toe Flax,$2.02 - $2.09,$3.12 - $3.23,35% off,No Bundles Avaliable,Free shipping for orders over $20,$0.00 - $1.00,0,No Brand,No Ratings Yet,0,0,0,yystore1.sg,253,4234,93%,within hours,6 months ago,26
/Original-FILA-Slip-Drifter-men-women-couple-FILA-slipper-sandal-slide-i.51834687.2043444712,Original FILA Slip Drifter men/women/couple FILA slipper sandal slide,$59.00 ,No Discount,No Discount,No Bundles Avaliable,No Free Shipping,$1.00 ,0,FILA,No Ratings Yet,0,0,1,fjhanlin.sg,41,187,88%,within hours,20 months ago,466
/Slippers-Men-And-Women-Wear-Anti-skid-Wear-resistant-Brea-i.107151707.2027349070,Slippers Men And Women Wear Anti-skid Wear-resistant Brea,$16.70 ,No Discount,No Discount,No Bundles Avaliable,Free shipping for orders over $20,$0.00 - $1.00,0,No Brand,No Ratings Yet,0,0,0,lbshop.sg,9,1355,89%,within hours,10 months ago,743
/Hot-Women-Men-Soft-Sports-Beach-Shower-Sandals-Home-Bath-Slippers-Shoes-Summer-i.44823802.2026289728,Hot Women/Men Soft Sports Beach Shower Sandals Home Bath Slippers Shoes Summer,$2.28 - $2.72,No Discount,No Discount,No Bundles Avaliable,Free shipping for orders over $20,$0.00 - $1.00,0,No Brand,No Ratings Yet,0,0,1,readyshopping.sg,255,242,52%,within hours,22 months ago,35
/Women-Men-Home-Indoor-Slippers-Bathe-Bottom-Non-Slip-Bathroom-Sandals-Flat-i.126261266.2021540085,Women Men Home Indoor Slippers Bathe Bottom Non-Slip Bathroom Sandals Flat,$6.03 ,$9.00 ,33% off,No Bundles Avaliable,Free shipping for orders over $20,$0.00 - $1.00,0,No Brand,No Ratings Yet,0,0,0,mymiss.sg,87,2513,100%,within hours,7 months ago,48
/Slippers-female-summer-fashion-outside-wearing-toe-net-red-man-drag-beach-sh-i.127694531.2008266796,Slippers female summer fashion outside wearing toe net red man drag beach sh,$6.39 ,$9.00 ,29% off,No Bundles Avaliable,Free shipping for orders over $20,$0.00 - $1.00,0,No Brand,No Ratings Yet,0,0,2,incooler88.sg,10,1019,55%,within hours,7 months ago,1
/Couple-slippers-men-and-women-indoor-home-with-Korean-version-of-adult-stu-i.130106495.2002071847,Couple slippers men and women indoor home with Korean version of adult stu,$7.20 ,$10.00 ,28% off,No Bundles Avaliable,Free shipping for orders over $20,$0.00 - $1.00,0,No Brand,No Ratings Yet,0,0,0,finney.sg,23,1095,81%,within hours,6 months ago,4
/New-Fashion-Men-Women-Linen-Indoor-Home-Slippers-Home-Garden-Household-Slippers-i.123357000.1985463145,New Fashion Men Women Linen Indoor Home Slippers Home Garden Household Slippers,$10.52 ,$26.30 ,60% off,No Bundles Avaliable,Free shipping for orders over $20,$0.00 - $1.00,0,No Brand,No Ratings Yet,0,0,0,emoo1.sg,1,916,57%,within hours,8 months ago,282
/New-Men-Women-Vogue-Winter-Warm-Slippers-Indoor-Floor-Shoes-Non-slip-House-Shoe-i.123357000.1985462759,New Men Women Vogue  Winter Warm Slippers Indoor Floor Shoes Non-slip House Shoe,$8.08 ,$20.20 ,60% off,No Bundles Avaliable,Free shipping for orders over $20,$0.00 - $1.00,0,No Brand,No Ratings Yet,0,0,0,emoo1.sg,1,916,57%,within hours,8 months ago,282
/Home-Indoor-couple-cotton-slippers-female-autumn-winter-men-anti-skid-Warm-hai-i.130107642.1984024795,Home Indoor couple cotton slippers female autumn winter men anti-skid Warm hai,$7.20 - $7.92,$10.00 - $11.00,28% off,No Bundles Avaliable,Free shipping for orders over $20,$0.00 - $1.00,0,No Brand,No Ratings Yet,0,0,0,sistery.sg,9,768,37%,within hours,6 months ago,5
/Anti-slip-leaking-bathroom-slippers-female-xia-home-men-shower-thick-bottom-co-i.130107642.1984024134,Anti-slip leaking bathroom slippers female xia home men shower thick bottom co,$6.48 ,$9.00 ,28% off,No Bundles Avaliable,Free shipping for orders over $20,$0.00 - $1.00,0,No Brand,No Ratings Yet,0,0,1,sistery.sg,9,768,37%,within hours,6 months ago,5
/Cotton-Slippers-Female-Winter-cute-Korean-version-couple-men-thickened-bottom-i.130107642.1984023618,Cotton Slippers Female Winter cute Korean version couple men thickened bottom ,$8.52 ,$12.00 ,29% off,No Bundles Avaliable,Free shipping for orders over $20,$0.00 - $1.00,0,No Brand,No Ratings Yet,0,0,0,sistery.sg,9,768,37%,within hours,6 months ago,5
/Spring-autumn-and-winter-home-children-slippers-men-women-couple-cotton-lin-i.130107642.1984022586,Spring autumn and winter home children slippers men women couple cotton lin,$6.90 ,$10.00 ,31% off,No Bundles Avaliable,Free shipping for orders over $20,$0.00 - $1.00,0,No Brand,No Ratings Yet,0,0,0,sistery.sg,9,768,37%,within hours,6 months ago,5
/Linen-Slippers-Female-Xia-home-indoor-thick-bottom-cartoon-couple-men-floor-i.130107642.1984022095,Linen Slippers Female Xia home indoor thick bottom cartoon couple men floor,$6.21 ,$9.00 ,31% off,No Bundles Avaliable,Free shipping for orders over $20,$0.00 - $1.00,0,No Brand,No Ratings Yet,0,0,0,sistery.sg,9,768,37%,within hours,6 months ago,5
/Cotton-slippers-Women's-winter-and-autumn-anti-skid-warm-men-women-home-indoo-i.130107642.1984021813,Cotton slippers Women's winter and autumn anti-skid warm men women home indoo,$6.39 ,$9.00 ,29% off,No Bundles Avaliable,Free shipping for orders over $20,$0.00 - $1.00,0,No Brand,No Ratings Yet,0,0,0,sistery.sg,9,768,37%,within hours,6 months ago,5
/Pu-Lint-slippers-men-and-women-winter-waterproof-warm-thick-bottom-furry-coupl-i.130107642.1984021257,Pu Lint slippers men and women winter waterproof warm thick bottom furry coupl,$7.00 - $7.70,$10.00 - $11.00,30% off,No Bundles Avaliable,Free shipping for orders over $20,$0.00 - $1.00,0,No Brand,No Ratings Yet,0,0,0,sistery.sg,9,768,37%,within hours,6 months ago,5
/Summer-home-indoor-couple-bathroom-slippers-men-and-women-bathing-anti-skid-i.130107642.1984020668,Summer home indoor couple bathroom slippers men and women bathing anti-skid ,$6.39 ,$9.00 ,29% off,No Bundles Avaliable,Free shipping for orders over $20,$0.00 - $1.00,0,No Brand,No Ratings Yet,0,0,0,sistery.sg,9,768,37%,within hours,6 months ago,5
/Linen-men-and-women-couple-slippers-home-indoor-flooring-Four-Seasons-spring--i.130107642.1984020232,Linen men and women couple slippers home indoor flooring Four Seasons spring,$6.80 ,$10.00 ,32% off,No Bundles Avaliable,Free shipping for orders over $20,$0.00 - $1.00,0,No Brand,No Ratings Yet,0,0,0,sistery.sg,9,768,37%,within hours,6 months ago,5
/Couple-indoor-slippers-female-summer-men-live-soft-bottom-bath-anti-skid-bathr-i.130107642.1984018451,Couple indoor slippers female summer men live soft bottom bath anti-skid bathr,$6.48 ,$9.00 ,28% off,No Bundles Avaliable,Free shipping for orders over $20,$0.00 - $1.00,0,No Brand,No Ratings Yet,0,0,0,sistery.sg,9,768,37%,within hours,6 months ago,5
/2018-New-Winter-striped-cotton-slippers-men-and-women-home-room-thick-bottom-K-i.130107642.1984014616,2018 New Winter striped cotton slippers men and women home room thick bottom K,$6.80 ,$6.80 - $10.00,32% off,No Bundles Avaliable,Free shipping for orders over $20,$0.00 - $1.00,0,No Brand,No Ratings Yet,0,0,1,sistery.sg,9,768,37%,within hours,6 months ago,5
/2019-New-slippers-female-summer-fashion-men-and-women-couple-indoor-home-anti--i.130107642.1984013994,2019 New slippers female summer fashion men and women couple indoor home anti-,$5.44 ,$8.00 ,32% off,No Bundles Avaliable,Free shipping for orders over $20,$0.00 - $1.00,0,No Brand,No Ratings Yet,0,0,0,sistery.sg,9,768,37%,within hours,6 months ago,5
/Couple-Baotou-slippers-men-summer-cave-shoes-Flat-Bottom-Beach-students-plas-i.130106495.1983481699,Couple Baotou slippers men summer cave shoes Flat Bottom Beach students plas,$6.80 ,$10.00 ,32% off,No Bundles Avaliable,Free shipping for orders over $20,$0.00 - $1.00,0,No Brand,No Ratings Yet,0,0,0,finney.sg,23,1095,81%,within hours,6 months ago,4
/Anti-slip-wear-resistant-herringbone-drag-male-splint-men-and-women-beach-cool-i.127694531.1982288218,Anti-slip wear-resistant herringbone drag male splint men and women beach cool,$7.70 ,$11.00 ,30% off,No Bundles Avaliable,Free shipping for orders over $20,$0.00 - $1.00,0,No brand,No Ratings Yet,0,0,0,incooler88.sg,10,1019,55%,within hours,7 months ago,1
/Anti-skid-soft-bottom-flip-man-couple-slippers-men-and-women-beach-cool-Drag-K-i.130105582.1981846218,Anti-skid soft bottom flip man couple slippers men and women beach cool Drag K,$9.66 ,$14.00 ,31% off,No Bundles Avaliable,Free shipping for orders over $20,$0.00 - $1.00,0,No brand,No Ratings Yet,0,0,0,tomochin.sg,13,761,72%,within hours,6 months ago,2
/Korean-men-and-women-slippers-Home-non-slip-wear-resistant-i.76226869.1980668887,Korean men and women slippers Home non-slip wear-resistant,$19.90 ,No Discount,No Discount,No Bundles Avaliable,Free shipping for orders over $20,$0.00 - $1.00,0,No Brand,No Ratings Yet,0,0,0,langwang.sg,65,2779,89%,within hours,15 months ago,561
/NICE-SHOES-Original-FILA-Slip-Drifter-men-women-couple-FILA-slipper-sandal-slide-i.131215105.1979476429,NICE SHOES Original FILA Slip Drifter men/women/couple FILA slipper sandal slide,$56.84 ,$116.00 ,51% off,No Bundles Avaliable,Free shipping for orders over $20,$0.00 ,0,FILA,No Ratings Yet,0,0,1,shoudie8390.sg,16,2284,36%,within hours,6 months ago,1302
/Women-Men-Home-Anti-slip-Warm-Cotton-Slip-on-Indoor-Slippers-Shoes-i.44824084.1970033579, PreferredWomen Men Home Anti-slip Warm Cotton Slip-on Indoor Slippers Shoes,$3.30 ,$6.54 ,50% off,No Bundles Avaliable,Free shipping for orders over $20,$0.00 - $1.00,0,No Brand,No Ratings Yet,0,0,0,everythinguwant.sg,1435,2696,99%,within hours,22 months ago,948
/Men-and-women-new-home-plastic-sandals-and-slippers-indoor-home-bathroom-lovers-i.76816895.1966637323,Men and women new home plastic sandals and slippers indoor home bathroom lovers,$6.37 ,$9.10 ,30% off,No Bundles Avaliable,No Free Shipping,$1.00 ,0,No Brand,No Ratings Yet,0,0,0,dycarfell2.sg,320,329,71%,within days,15 months ago,319
/Winter-Leather-home-cotton-slippers-men-and-women-warm-couple-indoor-anti-skid-i.111640885.1962495440,Winter Leather home cotton slippers men and women warm couple indoor anti-skid,$15.00 ,No Discount,No Discount,No Bundles Avaliable,No Free Shipping,$1.00 ,0,No Brand,No Ratings Yet,0,0,0,supermallshow.sg,370,3851,53%,within hours,9 months ago,112
/Summer-home-anti-skid-cowhide-slippers-Indoor-wood-floor-men-and-women-fashi-i.111640885.1962253326,Summer home anti-skid cowhide slippers Indoor wood floor men and women fashi,$10.00 ,No Discount,No Discount,No Bundles Avaliable,No Free Shipping,$1.00 ,0,No Brand,No Ratings Yet,0,0,0,supermallshow.sg,370,3851,53%,within hours,9 months ago,112
/Leather-Home-Slippers-men-and-women-spring-autumn-winter-indoor-wood-flooring-i.111640885.1962230008,Leather Home Slippers men and women spring autumn winter indoor wood flooring ,$10.00 ,No Discount,No Discount,No Bundles Avaliable,No Free Shipping,$1.00 ,0,No Brand,No Ratings Yet,0,0,0,supermallshow.sg,370,3851,53%,within hours,9 months ago,112
/Cold-Slippers-female-summer-men-couple-indoor-outside-wear-anti-skid-soft-bot-i.111640885.1962189195,Cold Slippers female summer men couple indoor outside wear anti-skid soft bot,$8.00 ,No Discount,No Discount,No Bundles Avaliable,No Free Shipping,$1.00 ,0,No Brand,No Ratings Yet,0,0,1,supermallshow.sg,370,3851,53%,within hours,9 months ago,112
/Japanese-tasteless-home-indoor-anti-skid-soft-bottom-couple-bathing-men-and-wo-i.111640885.1962188768,Japanese tasteless home indoor anti-skid soft bottom couple bathing men and wo,$8.00 ,No Discount,No Discount,No Bundles Avaliable,No Free Shipping,$1.00 ,0,No Brand,No Ratings Yet,0,0,0,supermallshow.sg,370,3851,53%,within hours,9 months ago,112
/Leaky-bathroom-slippers-men-and-women-indoor-bath-anti-skid-summer-home-lig-i.111640885.1962188485,Leaky bathroom slippers men and women indoor bath anti-skid summer home lig,$9.00 ,No Discount,No Discount,No Bundles Avaliable,No Free Shipping,$1.00 ,0,No Brand,No Ratings Yet,0,0,0,supermallshow.sg,370,3851,53%,within hours,9 months ago,112
/Winter-couple-cotton-slippers-men-and-women-pu-skin-waterproof-half-pack-wit-i.111640885.1962188334,Winter couple cotton slippers men and women pu skin waterproof half pack wit,$8.00 - $9.00,No Discount,No Discount,No Bundles Avaliable,No Free Shipping,$1.00 ,0,No Brand,No Ratings Yet,0,0,0,supermallshow.sg,370,3851,53%,within hours,9 months ago,112
/Leather-slippers-men-and-women-winter-warm-cotton-anti-skid-waterproof-coup-i.111640885.1962188014,Leather slippers men and women winter warm cotton anti-skid waterproof coup,$8.00 ,No Discount,No Discount,No Bundles Avaliable,No Free Shipping,$1.00 ,0,No Brand,No Ratings Yet,0,0,0,supermallshow.sg,370,3851,53%,within hours,9 months ago,112
/Spring-summer-autumn-and-winter-household-linen-slippers-men-women-couple-i-i.111640885.1962145386,Spring summer autumn and winter household linen slippers men women couple i,$6.00 ,No Discount,No Discount,No Bundles Avaliable,No Free Shipping,$1.00 ,0,No Brand,No Ratings Yet,0,0,0,supermallshow.sg,370,3851,53%,within hours,9 months ago,112
/Bathroom-Slippers-anti-skid-shower-leaking-men-and-women-summer-thick-bottom-i.111640885.1962144856,Bathroom Slippers anti-skid shower leaking men and women summer thick bottom,$7.00 ,No Discount,No Discount,No Bundles Avaliable,No Free Shipping,$1.00 ,0,No Brand,No Ratings Yet,0,0,3,supermallshow.sg,370,3851,53%,within hours,9 months ago,112
/Slippers-female-summer-Indoor-couple-soft-bottom-home-household-thick-men-sh-i.111640885.1962144522,Slippers female summer Indoor couple soft bottom home household thick men sh,$7.00 ,No Discount,No Discount,No Bundles Avaliable,No Free Shipping,$1.00 ,0,No Brand,No Ratings Yet,0,0,0,supermallshow.sg,370,3851,53%,within hours,9 months ago,112
